20/09/2021 11:41:49,Julien,PAN,julienpan1234@gmail.com,17802782,,M2 THYP,https://drive.google.com/open?id=1S-6IQJGBznAe-II8VBNWO38y6AitUbWo,Oui,De qualité moyenne,De bonne qualité,De bonne qualité,Pas utilisé,julienpan,julienpan,,"Développeur, Concepteur","Développeur, Concepteur, Ingénieur informatique, Banques, Assurances",M1 Informatique,Pas besoin,Pas besoin,Besoin d'approfondissement,Pas besoin,Besoin d'approfondissement,Pas besoin,Besoin d'approfondissement,Besoin d'approfondissement,Pas besoin,Pas besoin,Besoin d'approfondissement,Besoin d'approfondissement,Pas besoin,Pas besoin,Pas besoin,Pas besoin,Pas besoin,Pas besoin,Besoin urgent,Pas besoin,Pas besoin,Besoin d'approfondissement,Besoin d'approfondissement,Besoin d'approfondissement,Besoin d'approfondissement,Besoin d'approfondissement,Pas besoin,Besoin d'approfondissement,Besoin d'approfondissement,je connais bien,je suis expert(e),je connais un peu,je connais bien,je connais bien,je connais bien,je connais un peu,je connais un peu,je connais un peu,je connais bien,je connais bien,je connais un peu,je connais bien,je connais un peu,je connais un peu,je connais bien,je connais bien,je connais bien,je ne connais pas du tout,je connais un peu,je connais un peu,je connais un peu,je connais un peu,je connais un peu,,je connais un peu,je connais bien,je connais bien,je connais bien,je connais un peu,je ne connais pas du tout,je connais un peu,je connais un peu,je ne connais pas du tout,je ne connais pas du tout,je ne connais pas du tout,je connais un peu,je connais un peu,je connais bien,je ne connais pas du tout,je ne connais pas du tout,je ne connais pas du tout,je ne connais pas du tout,je connais bien,je connais bien,je connais bien,je connais bien,je connais bien,je connais un peu,je connais bien,je ne connais pas du tout,je ne connais pas du tout,je ne connais pas du tout,je connais bien,je ne connais pas du tout,je connais bien,je ne connais pas du tout,je ne connais pas du tout,je ne connais pas du tout,je connais bien,je ne connais pas du tout,je connais bien,je connais bien,je connais bien,je connais bien,je connais bien,je connais bien,je connais bien,je connais bien,je connais bien,je connais bien,je connais bien,je connais bien,je connais bien,,je connais bien,je connais bien,je connais bien,je ne connais pas du tout,je ne connais pas du tout,je connais un peu,je ne connais pas du tout,je ne connais pas du tout,je connais bien,je connais bien,je connais un peu,je connais un peu,je connais un peu,je connais bien,je ne connais pas du tout,je ne connais pas du tout,je ne connais pas du tout,je suis expert(e),je connais bien,je ne connais pas du tout,je ne connais pas du tout,je ne connais pas du tout,je ne connais pas du tout,je ne connais pas du tout,je ne connais pas du tout,je ne connais pas du tout,je ne connais pas du tout,je connais bien,je ne connais pas du tout,je ne connais pas du tout,je ne connais pas du tout,je ne connais pas du tout,je ne connais pas du tout,je ne connais pas du tout,je connais un peu,je ne connais pas du tout,,je ne connais pas du tout,je connais un peu,je connais un peu,je connais bien,je ne connais pas du tout,,je connais un peu,je connais un peu,rarement,rarement,souvent,souvent,souvent,souvent,souvent,souvent,jamais,jamais,souvent,jamais,jamais,souvent,jamais,jamais,jamais,jamais,souvent,jamais,Pas utilisé,je ne connais pas du tout,,je ne connais pas du tout,je ne connais pas du tout,je ne connais pas du tout,je ne connais pas du tout,je ne connais pas du tout,je ne connais pas du tout,je ne connais pas du tout
20/09/2021 18:18:15,Belmehdi,Fedoua,belmehdi.fdiwa@gmail.com,21008725,,M2 THYP,https://drive.google.com/open?id=19eRGV-3nz3vVPwVmHBtN4sujpCiTT8pt,Oui,De bonne qualité,De qualité moyenne,Pas utilisé,Pas utilisé,fdiwa852,fadoua123,fadoua124,"Développeur, Chef de projet, Veille","Développeur, Concepteur, Chef de projet, Veille, Ingénieur informatique",M1-Ingénierie des Systèmes d'informations(ESISA),Besoin d'approfondissement,Besoin urgent,Besoin urgent,Besoin d'approfondissement,Besoin d'approfondissement,Besoin d'approfondissement,Besoin urgent,Besoin d'approfondissement,,Besoin d'approfondissement,Besoin d'approfondissement,Besoin d'approfondissement,Besoin d'approfondissement,Besoin urgent,Pas besoin,Pas besoin,Besoin urgent,,Besoin d'approfondissement,Besoin d'approfondissement,Besoin d'approfondissement,Besoin urgent,Besoin d'approfondissement,Besoin d'approfondissement,Besoin d'approfondissement,,Besoin d'approfondissement,Besoin urgent,Besoin urgent,je connais bien,je connais un peu,je ne connais pas du tout,je connais un peu,je connais un peu,je connais un peu,je connais un peu,je connais un peu,je connais bien,je connais un peu,je connais un peu,je connais un peu,je connais bien,je connais bien,je connais un peu,je connais un peu,je connais bien,je connais un peu,je connais un peu,je connais un peu,je connais un peu,je connais un peu,je connais un peu,je connais bien,je connais bien,je connais bien,je connais bien,je connais un peu,je connais un peu,je ne connais pas du tout,je ne connais pas du tout,je ne connais pas du tout,je connais un peu,je connais un peu,je ne connais pas du tout,je ne connais pas du tout,je ne connais pas du tout,je connais bien,je connais un peu,je connais bien,je ne connais pas du tout,je ne connais pas du tout,je ne connais pas du tout,,je connais bien,je connais bien,je ne connais pas du tout,je connais bien,je connais un peu,je ne connais pas du tout,je ne connais pas du tout,je ne connais pas du tout,je connais bien,je connais un peu,je ne connais pas du tout,je ne connais pas du tout,je connais bien,je ne connais pas du tout,,je connais bien,je ne connais pas du tout,je connais un peu,je ne connais pas du tout,je connais un peu,je connais bien,je connais bien,je ne connais pas du tout,je ne connais pas du tout,je ne connais pas du tout,je connais un peu,je connais bien,je connais bien,je connais un peu,je connais un peu,je connais bien,je connais un peu,je connais bien,je connais bien,je ne connais pas du tout,je ne connais pas du tout,je connais bien,je connais bien,je ne connais pas du tout,je ne connais pas du tout,je ne connais pas du tout,je ne connais pas du tout,je connais bien,je connais bien,je connais bien,je ne connais pas du tout,je ne connais pas du tout,je ne connais pas du tout,je connais bien,je connais bien,je connais bien,je ne connais pas du tout,je ne connais pas du tout,je ne connais pas du tout,je ne connais pas du tout,je ne connais pas du tout,je ne connais pas du tout,je ne connais pas du tout,je ne connais pas du tout,je ne connais pas du tout,je ne connais pas du tout,je ne connais pas du tout,je ne connais pas du tout,je ne connais pas du tout,je ne connais pas du tout,je connais un peu,je connais un peu,je ne connais pas du tout,je ne connais pas du tout,je ne connais pas du tout,je ne connais pas du tout,je ne connais pas du tout,je ne connais pas du tout,je ne connais pas du tout,je connais un peu,je connais un peu,souvent,jamais,rarement,souvent,souvent,jamais,souvent,jamais,jamais,jamais,souvent,jamais,jamais,rarement,jamais,jamais,jamais,jamais,jamais,jamais,Pas utilisé,je ne connais pas du tout,,je ne connais pas du tout,je ne connais pas du tout,je ne connais pas du tout,je ne connais pas du tout,je ne connais pas du tout,je ne connais pas du tout,je ne connais pas du tout
20/09/2021 18:47:31,Aimen Khalil,Hamama,khalil.aymen25@gmail.com,0,,M2 THYP,https://drive.google.com/open?id=14XjGwn15DGBSG4v-ACmJ4JzQiNv4ef9x,Oui,De qualité moyenne,,,,khalilaimen25,khalilaimen,khalil.aimen25,"Développeur, Ingénieur informatique, Artiste","Développeur, Ingénieur informatique",sciences et technologies de l'information et de la communication,Pas besoin,Pas besoin,Besoin urgent,Besoin urgent,Besoin urgent,Besoin d'approfondissement,Besoin d'approfondissement,Besoin d'approfondissement,Besoin d'approfondissement,Besoin d'approfondissement,Besoin d'approfondissement,Besoin d'approfondissement,Besoin d'approfondissement,Besoin d'approfondissement,Besoin d'approfondissement,Besoin d'approfondissement,Besoin d'approfondissement,Pas besoin,Pas besoin,Pas besoin,Besoin d'approfondissement,Besoin d'approfondissement,Besoin d'approfondissement,Besoin d'approfondissement,Pas besoin,Besoin d'approfondissement,Besoin urgent,Besoin urgent,Besoin urgent,je connais bien,je connais bien,je connais bien,je connais bien,je connais bien,je connais un peu,je ne connais pas du tout,je connais un peu,je ne connais pas du tout,je ne connais pas du tout,je ne connais pas du tout,je ne connais pas du tout,je ne connais pas du tout,je ne connais pas du tout,je ne connais pas du tout,je ne connais pas du tout,je ne connais pas du tout,je ne connais pas du tout,je ne connais pas du tout,je ne connais pas du tout,je ne connais pas du tout,je ne connais pas du tout,je connais un peu,je connais un peu,je ne connais pas du tout,je ne connais pas du tout,,je connais un peu,je connais un peu,je connais un peu,je ne connais pas du tout,je connais bien,je connais un peu,je connais un peu,je ne connais pas du tout,je ne connais pas du tout,je ne connais pas du tout,je connais bien,je connais un peu,je ne connais pas du tout,je ne connais pas du tout,je connais un peu,je ne connais pas du tout,je ne connais pas du tout,je connais bien,je connais bien,je ne connais pas du tout,je connais bien,je ne connais pas du tout,je ne connais pas du tout,je connais un peu,je ne connais pas du tout,je ne connais pas du tout,je connais bien,je ne connais pas du tout,je ne connais pas du tout,je ne connais pas du tout,je ne connais pas du tout,je ne connais pas du tout,je connais bien,je ne connais pas du tout,je ne connais pas du tout,je connais bien,je connais bien,je connais bien,je connais un peu,je connais un peu,je ne connais pas du tout,je ne connais pas du tout,je connais bien,je connais bien,je connais bien,je connais un peu,je connais un peu,je connais un peu,je connais bien,je connais bien,je connais bien,je ne connais pas du tout,je ne connais pas du tout,je connais bien,je ne connais pas du tout,je ne connais pas du tout,je connais bien,je ne connais pas du tout,je ne connais pas du tout,je connais un peu,je connais un peu,je connais un peu,je ne connais pas du tout,je ne connais pas du tout,je ne connais pas du tout,je connais bien,je connais bien,je connais bien,,,,,,,,,,,,,,,je connais un peu,je ne connais pas du tout,je ne connais pas du tout,je ne connais pas du tout,je ne connais pas du tout,je ne connais pas du tout,je connais un peu,je ne connais pas du tout,je ne connais pas du tout,je ne connais pas du tout,je ne connais pas du tout,souvent,jamais,rarement,rarement,souvent,rarement,jamais,jamais,jamais,jamais,je suis accro,jamais,jamais,jamais,jamais,jamais,jamais,jamais,souvent,jamais,,,,,,,,,,
20/09/2021 22:10:48,wissal,abidi,wissalabidi999@gmail.com,21,,M2 THYP,https://drive.google.com/open?id=1pcodsOVY-BSqXv9UoPOBYSCj5fH0J9ND,Oui,,De bonne qualité,,,wissal3455,wissalabidi,wissalabidi10,"Développeur, Concepteur, Ingénieur informatique, Banques","Développeur, Concepteur, Chef de projet, Data analyste, Ingénieur informatique, Banques",,Besoin d'approfondissement,Besoin d'approfondissement,Besoin d'approfondissement,Besoin d'approfondissement,Pas besoin,Pas besoin,Besoin d'approfondissement,Besoin d'approfondissement,Besoin d'approfondissement,Besoin d'approfondissement,Besoin d'approfondissement,Besoin d'approfondissement,Besoin d'approfondissement,Besoin d'approfondissement,Besoin d'approfondissement,Besoin d'approfondissement,Besoin d'approfondissement,,Besoin d'approfondissement,Besoin d'approfondissement,Besoin d'approfondissement,Besoin d'approfondissement,Besoin d'approfondissement,Besoin d'approfondissement,,Besoin d'approfondissement,,Besoin d'approfondissement,Besoin d'approfondissement,je connais un peu,je connais un peu,je connais un peu,je connais un peu,je connais un peu,je ne connais pas du tout,je ne connais pas du tout,je ne connais pas du tout,je ne connais pas du tout,je connais un peu,je connais un peu,je ne connais pas du tout,je ne connais pas du tout,je ne connais pas du tout,je ne connais pas du tout,je ne connais pas du tout,je ne connais pas du tout,je ne connais pas du tout,je ne connais pas du tout,je connais un peu,je connais un peu,,je connais bien,je connais bien,je ne connais pas du tout,je connais un peu,je connais un peu,je connais un peu,je connais un peu,je connais un peu,je connais un peu,je ne connais pas du tout,je ne connais pas du tout,je ne connais pas du tout,je ne connais pas du tout,,je ne connais pas du tout,je connais bien,je connais un peu,je connais un peu,je connais un peu,,je connais un peu,je connais bien,je connais bien,je connais bien,je connais un peu,je connais bien,je connais bien,je connais un peu,je ne connais pas du tout,je ne connais pas du tout,je connais bien,je connais bien,je connais un peu,je connais un peu,je connais un peu,je connais un peu,je connais un peu,je connais bien,je connais un peu,je connais bien,je connais un peu,je connais bien,je connais bien,je connais bien,je connais un peu,je connais un peu,je ne connais pas du tout,je connais bien,je connais bien,je connais bien,je connais bien,je connais bien,je connais bien,je connais bien,je connais bien,je connais bien,je ne connais pas du tout,je ne connais pas du tout,je connais bien,je connais bien,je ne connais pas du tout,je ne connais pas du tout,je ne connais pas du tout,je ne connais pas du tout,je connais un peu,je connais bien,je connais bien,je ne connais pas du tout,je ne connais pas du tout,je ne connais pas du tout,je connais bien,je connais un peu,je suis expert(e),je ne connais pas du tout,je ne connais pas du tout,je ne connais pas du tout,je ne connais pas du tout,je ne connais pas du tout,je ne connais pas du tout,je ne connais pas du tout,je ne connais pas du tout,je ne connais pas du tout,je ne connais pas du tout,je ne connais pas du tout,je ne connais pas du tout,je ne connais pas du tout,je ne connais pas du tout,je connais un peu,je ne connais pas du tout,je ne connais pas du tout,je ne connais pas du tout,je ne connais pas du tout,je ne connais pas du tout,je connais un peu,je ne connais pas du tout,je ne connais pas du tout,je ne connais pas du tout,je connais un peu,souvent,jamais,souvent,souvent,souvent,rarement,souvent,rarement,rarement,rarement,souvent,rarement,rarement,rarement,rarement,rarement,rarement,rarement,rarement,rarement,,je ne connais pas du tout,,je ne connais pas du tout,je ne connais pas du tout,je ne connais pas du tout,je ne connais pas du tout,je ne connais pas du tout,je ne connais pas du tout,je ne connais pas du tout
20/09/2021 22:12:23,Othmane,Titnaalaoui idrissi,othmantitna@gmail.com,21009069,,M2 THYP,https://drive.google.com/open?id=1v1x2VffEPhsyQiiZ6_4t7f_rW543dNJ8,Oui,De qualité moyenne,De qualité moyenne,,,othmane titna,othmanetitna,,Développeur,Développeur,,Besoin d'approfondissement,Besoin d'approfondissement,Besoin urgent,Besoin d'approfondissement,Besoin d'approfondissement,Besoin urgent,Besoin urgent,Besoin d'approfondissement,Pas besoin,Besoin d'approfondissement,Besoin urgent,Besoin d'approfondissement,Besoin d'approfondissement,Besoin d'approfondissement,Besoin d'approfondissement,Besoin d'approfondissement,Besoin d'approfondissement,Besoin d'approfondissement,Besoin urgent,Besoin d'approfondissement,Besoin urgent,Besoin d'approfondissement,Pas besoin,Pas besoin,Besoin urgent,Besoin d'approfondissement,Besoin d'approfondissement,Besoin d'approfondissement,Besoin d'approfondissement,je connais bien,je connais bien,je connais bien,je connais un peu,je connais un peu,je ne connais pas du tout,je ne connais pas du tout,je connais un peu,je connais un peu,je connais bien,je connais bien,je ne connais pas du tout,je connais bien,je connais un peu,je connais un peu,je connais un peu,je connais bien,je ne connais pas du tout,je ne connais pas du tout,je connais un peu,je connais un peu,je connais un peu,je suis expert(e),je suis expert(e),je connais un peu,je connais bien,je connais bien,je connais un peu,je connais un peu,je connais un peu,je connais un peu,je ne connais pas du tout,je ne connais pas du tout,je ne connais pas du tout,je ne connais pas du tout,je ne connais pas du tout,je ne connais pas du tout,je suis expert(e),je connais bien,je connais un peu,je connais un peu,je ne connais pas du tout,je ne connais pas du tout,je connais bien,je connais bien,je connais bien,je ne connais pas du tout,je suis expert(e),je connais bien,je ne connais pas du tout,je ne connais pas du tout,je ne connais pas du tout,je connais bien,je connais bien,je ne connais pas du tout,je ne connais pas du tout,je connais bien,je ne connais pas du tout,je ne connais pas du tout,je suis expert(e),je connais un peu,je ne connais pas du tout,je ne connais pas du tout,je connais bien,je suis expert(e),je connais un peu,je connais un peu,je ne connais pas du tout,je ne connais pas du tout,je connais bien,je connais bien,je connais bien,je connais bien,je connais bien,je connais bien,je connais bien,je connais bien,je connais bien,je ne connais pas du tout,je ne connais pas du tout,je connais bien,je connais bien,je ne connais pas du tout,je ne connais pas du tout,je ne connais pas du tout,je connais un peu,je connais un peu,je connais bien,je connais bien,je ne connais pas du tout,je ne connais pas du tout,je connais un peu,je suis expert(e),je connais bien,je suis expert(e),je connais un peu,je ne connais pas du tout,je ne connais pas du tout,je ne connais pas du tout,je ne connais pas du tout,je ne connais pas du tout,je ne connais pas du tout,je ne connais pas du tout,je ne connais pas du tout,je ne connais pas du tout,je ne connais pas du tout,je ne connais pas du tout,je ne connais pas du tout,je ne connais pas du tout,je connais bien,je connais un peu,je ne connais pas du tout,je ne connais pas du tout,je ne connais pas du tout,je ne connais pas du tout,je ne connais pas du tout,je ne connais pas du tout,je connais un peu,je ne connais pas du tout,je ne connais pas du tout,souvent,souvent,souvent,souvent,souvent,souvent,souvent,souvent,souvent,jamais,souvent,jamais,jamais,jamais,jamais,rarement,jamais,jamais,jamais,jamais,,je ne connais pas du tout,,je ne connais pas du tout,je ne connais pas du tout,je ne connais pas du tout,je ne connais pas du tout,je ne connais pas du tout,je ne connais pas du tout,je ne connais pas du tout
20/09/2021 22:29:14,Nolwen,Boriero,nolwenboriero@gmail.com,20022576,,M1 CEN,https://drive.google.com/open?id=1mf9lMky8SA98PBux1zHWYhWFFZ-TywjN,Non,Pas utilisé,De bonne qualité,De bonne qualité,Pas utilisé,,,,Graphiste,"Graphiste, Artiste",Licence professionnelle : Communication interactive et multimédia,Besoin d'approfondissement,Pas besoin,Besoin d'approfondissement,Besoin d'approfondissement,Besoin d'approfondissement,Pas besoin,Besoin d'approfondissement,Besoin d'approfondissement,Besoin d'approfondissement,Besoin d'approfondissement,Besoin d'approfondissement,Besoin d'approfondissement,Besoin d'approfondissement,Pas besoin,Pas besoin,Pas besoin,Pas besoin,Pas besoin,Pas besoin,Pas besoin,Pas besoin,Besoin d'approfondissement,Besoin d'approfondissement,Besoin d'approfondissement,Pas besoin,Pas besoin,Besoin d'approfondissement,Besoin d'approfondissement,Besoin d'approfondissement,,,,,,,,,,,,,,,,,,,,,,,,,,,,,,je connais bien,je connais bien,je ne connais pas du tout,je ne connais pas du tout,je ne connais pas du tout,je ne connais pas du tout,je connais un peu,je connais un peu,je ne connais pas du tout,je connais bien,je connais un peu,,je ne connais pas du tout,je ne connais pas du tout,je ne connais pas du tout,je connais un peu,je ne connais pas du tout,je ne connais pas du tout,je connais un peu,je ne connais pas du tout,je ne connais pas du tout,je connais bien,je ne connais pas du tout,je ne connais pas du tout,je connais un peu,je ne connais pas du tout,je ne connais pas du tout,je ne connais pas du tout,je ne connais pas du tout,je ne connais pas du tout,je connais bien,je connais bien,je connais bien,je ne connais pas du tout,je ne connais pas du tout,je connais un peu,je ne connais pas du tout,je connais un peu,je connais un peu,je ne connais pas du tout,je connais un peu,je connais bien,je connais bien,je ne connais pas du tout,je ne connais pas du tout,je connais un peu,je connais un peu,je connais un peu,je connais un peu,je ne connais pas du tout,je ne connais pas du tout,je connais un peu,je ne connais pas du tout,je ne connais pas du tout,je ne connais pas du tout,je ne connais pas du tout,je ne connais pas du tout,je ne connais pas du tout,je ne connais pas du tout,je ne connais pas du tout,je ne connais pas du tout,je ne connais pas du tout,je ne connais pas du tout,je suis expert(e),je connais bien,,je connais un peu,je ne connais pas du tout,je ne connais pas du tout,je ne connais pas du tout,je ne connais pas du tout,je ne connais pas du tout,je ne connais pas du tout,je ne connais pas du tout,je connais un peu,je ne connais pas du tout,je ne connais pas du tout,je ne connais pas du tout,je ne connais pas du tout,je ne connais pas du tout,je connais bien,je ne connais pas du tout,je ne connais pas du tout,je ne connais pas du tout,je ne connais pas du tout,je ne connais pas du tout,je connais bien,je ne connais pas du tout,je ne connais pas du tout,je connais bien,je ne connais pas du tout,jamais,jamais,souvent,souvent,souvent,souvent,jamais,souvent,jamais,jamais,je suis accro,jamais,jamais,rarement,jamais,jamais,jamais,jamais,jamais,jamais,Pas utilisé,je ne connais pas du tout,,je ne connais pas du tout,je ne connais pas du tout,je ne connais pas du tout,je ne connais pas du tout,je ne connais pas du tout,je ne connais pas du tout,je ne connais pas du tout
20/09/2021 22:47:36,othmane,Ammour,ammour.othmane99@gmail.com,21008194,,M2 THYP,https://drive.google.com/open?id=1Rajp2SD1T90WObs8L1c5jhEeHmx0smRc,Oui,,,,,ammour99,ammourothmane,ammourothmane,Développeur,Développeur,Ingénierie Logiciel,Pas besoin,Pas besoin,Pas besoin,Pas besoin,Pas besoin,Pas besoin,Besoin d'approfondissement,Besoin d'approfondissement,Besoin d'approfondissement,Pas besoin,Besoin d'approfondissement,Besoin d'approfondissement,Pas besoin,Pas besoin,Besoin d'approfondissement,Pas besoin,Pas besoin,Besoin d'approfondissement,Besoin d'approfondissement,Pas besoin,Pas besoin,Pas besoin,Pas besoin,Pas besoin,Pas besoin,Pas besoin,Pas besoin,Besoin d'approfondissement,Besoin d'approfondissement,je connais bien,je suis expert(e),je connais bien,je connais bien,je connais bien,je connais bien,je connais un peu,je connais un peu,je connais un peu,je connais bien,je connais un peu,je connais un peu,je connais bien,je connais un peu,je connais un peu,je connais bien,je connais bien,je connais bien,je connais un peu,je connais bien,je connais un peu,je connais bien,je connais bien,je connais bien,je connais un peu,je connais bien,je connais bien,je connais un peu,je connais un peu,je connais un peu,je ne connais pas du tout,je connais un peu,je ne connais pas du tout,je ne connais pas du tout,je ne connais pas du tout,je ne connais pas du tout,je ne connais pas du tout,je connais bien,je connais un peu,je ne connais pas du tout,je ne connais pas du tout,je connais un peu,,je connais bien,je connais bien,je connais bien,je connais un peu,je connais bien,je connais bien,je connais un peu,je ne connais pas du tout,je connais un peu,je connais bien,je connais bien,je ne connais pas du tout,je connais un peu,je connais bien,je connais un peu,je connais un peu,je connais bien,je ne connais pas du tout,je connais bien,je connais un peu,je connais bien,je connais bien,je connais bien,je ne connais pas du tout,je ne connais pas du tout,je ne connais pas du tout,je connais un peu,je connais bien,je connais bien,je connais bien,je connais bien,je connais bien,je connais un peu,je connais bien,je connais bien,je ne connais pas du tout,je ne connais pas du tout,je connais bien,je connais bien,je connais un peu,je ne connais pas du tout,je ne connais pas du tout,je ne connais pas du tout,je ne connais pas du tout,je connais un peu,je connais un peu,je ne connais pas du tout,je ne connais pas du tout,je ne connais pas du tout,je connais bien,je connais un peu,je suis expert(e),je ne connais pas du tout,je ne connais pas du tout,je ne connais pas du tout,je ne connais pas du tout,je ne connais pas du tout,je ne connais pas du tout,je ne connais pas du tout,je ne connais pas du tout,je ne connais pas du tout,je ne connais pas du tout,je ne connais pas du tout,je ne connais pas du tout,je ne connais pas du tout,je ne connais pas du tout,je connais bien,je ne connais pas du tout,je ne connais pas du tout,je ne connais pas du tout,je ne connais pas du tout,je ne connais pas du tout,je connais bien,je ne connais pas du tout,je ne connais pas du tout,je ne connais pas du tout,je ne connais pas du tout,souvent,souvent,souvent,souvent,souvent,jamais,rarement,rarement,rarement,,souvent,jamais,jamais,rarement,jamais,rarement,jamais,jamais,rarement,jamais,De bonne qualité,je ne connais pas du tout,,je ne connais pas du tout,je ne connais pas du tout,je ne connais pas du tout,je ne connais pas du tout,je ne connais pas du tout,je ne connais pas du tout,je ne connais pas du tout
