01/10/2021 14:31:40,Salima,Benchabane,salima_2991@live.fr,0g7bcv04wp3,REFUS car pas dans ENT,M2 AVUN,https://drive.google.com/open?id=1wGK300SLXJymDl6JybpmxrlQ0SR-HfiS,Oui,,De qualité moyenne,,,,,,"Data analyste, Community manager","Chef de projet, Data analyste, Community manager",Docteur en médecine dentaire,Besoin urgent,Besoin urgent,Besoin urgent,Besoin d'approfondissement,Besoin d'approfondissement,Besoin urgent,Besoin urgent,Besoin urgent,Besoin d'approfondissement,Besoin d'approfondissement,Besoin d'approfondissement,Besoin d'approfondissement,Besoin d'approfondissement,Besoin d'approfondissement,Besoin urgent,Besoin d'approfondissement,Besoin urgent,Besoin d'approfondissement,Pas besoin,Besoin d'approfondissement,Besoin d'approfondissement,Besoin urgent,Besoin urgent,Besoin urgent,Besoin urgent,Besoin urgent,Besoin urgent,Besoin urgent,Besoin urgent,je connais un peu,je connais un peu,je connais un peu,je connais un peu,je connais un peu,je connais un peu,je connais un peu,je connais un peu,je connais un peu,je connais un peu,je connais un peu,je connais un peu,je connais bien,je connais un peu,je ne connais pas du tout,je connais un peu,je connais un peu,je connais un peu,je ne connais pas du tout,je connais un peu,je connais bien,je connais un peu,je connais un peu,je connais un peu,je connais un peu,je connais un peu,je connais un peu,je ne connais pas du tout,je ne connais pas du tout,je connais un peu,je ne connais pas du tout,je ne connais pas du tout,je ne connais pas du tout,je connais un peu,je ne connais pas du tout,je ne connais pas du tout,je connais un peu,je ne connais pas du tout,je ne connais pas du tout,je ne connais pas du tout,je connais un peu,je ne connais pas du tout,je ne connais pas du tout,je ne connais pas du tout,je ne connais pas du tout,je ne connais pas du tout,je ne connais pas du tout,je ne connais pas du tout,je ne connais pas du tout,je ne connais pas du tout,je ne connais pas du tout,je ne connais pas du tout,je ne connais pas du tout,je connais un peu,je ne connais pas du tout,je ne connais pas du tout,je ne connais pas du tout,je ne connais pas du tout,je ne connais pas du tout,je ne connais pas du tout,je ne connais pas du tout,je ne connais pas du tout,je ne connais pas du tout,je ne connais pas du tout,je ne connais pas du tout,je ne connais pas du tout,je ne connais pas du tout,je ne connais pas du tout,je ne connais pas du tout,je connais un peu,je connais un peu,je ne connais pas du tout,je ne connais pas du tout,je ne connais pas du tout,je ne connais pas du tout,je connais un peu,je connais un peu,je ne connais pas du tout,je ne connais pas du tout,je ne connais pas du tout,je ne connais pas du tout,je ne connais pas du tout,je ne connais pas du tout,je ne connais pas du tout,je ne connais pas du tout,je ne connais pas du tout,je ne connais pas du tout,je ne connais pas du tout,je ne connais pas du tout,je ne connais pas du tout,je ne connais pas du tout,je ne connais pas du tout,je suis expert(e),je connais bien,je suis expert(e),je connais un peu,je suis expert(e),je ne connais pas du tout,je ne connais pas du tout,je ne connais pas du tout,je ne connais pas du tout,je ne connais pas du tout,je ne connais pas du tout,je ne connais pas du tout,je ne connais pas du tout,je ne connais pas du tout,je ne connais pas du tout,je ne connais pas du tout,je ne connais pas du tout,je ne connais pas du tout,je ne connais pas du tout,je ne connais pas du tout,je ne connais pas du tout,je ne connais pas du tout,je ne connais pas du tout,je connais un peu,je ne connais pas du tout,je ne connais pas du tout,je ne connais pas du tout,je ne connais pas du tout,souvent,rarement,je suis accro,je suis accro,souvent,souvent,rarement,jamais,,jamais,je suis accro,jamais,jamais,rarement,jamais,jamais,jamais,rarement,souvent,jamais,,je ne connais pas du tout,,je ne connais pas du tout,je ne connais pas du tout,je ne connais pas du tout,je ne connais pas du tout,je ne connais pas du tout,je ne connais pas du tout,je ne connais pas du tout
01/10/2021 15:23:39,Thuy Huong,NGUYEN,thuyhuong.lc1994@gmail.com,18905622,non,M2 AVUN,https://drive.google.com/open?id=1gmIeSXwhpAhluS34MxCmByc--PUboiQt,Oui,De qualité moyenne,,,,ThuyHuongNguyen,nguyenthuyhuong,nguyenthuyhuong,"Graphiste, Concepteur, Rédacteur, Commercial, Community manager, Veille","Chef de projet, Data analyste, Enseignant",Master 1 Gestion Stratégique de l'Information  - Université de Paris 8. Licence Information & Communication ITIC - Université Paul Valéry. Licence pro Management des organisations - Université de Toulon,Besoin d'approfondissement,Besoin d'approfondissement,Besoin d'approfondissement,Besoin d'approfondissement,Besoin d'approfondissement,Besoin d'approfondissement,Besoin d'approfondissement,Besoin d'approfondissement,Besoin d'approfondissement,Besoin d'approfondissement,Besoin d'approfondissement,Besoin d'approfondissement,Besoin d'approfondissement,Besoin d'approfondissement,Besoin d'approfondissement,Besoin d'approfondissement,Besoin d'approfondissement,Besoin d'approfondissement,Besoin d'approfondissement,Besoin d'approfondissement,Besoin d'approfondissement,Besoin d'approfondissement,Besoin urgent,Besoin urgent,Besoin d'approfondissement,Besoin d'approfondissement,Besoin d'approfondissement,Besoin d'approfondissement,Besoin d'approfondissement,je connais bien,je connais bien,je connais un peu,je connais un peu,je connais bien,je connais bien,je connais bien,je connais bien,je connais un peu,je connais un peu,je connais un peu,je connais bien,je connais bien,je connais bien,je connais bien,je connais bien,je connais bien,je connais bien,je connais bien,je connais un peu,je connais un peu,je connais bien,je connais bien,je connais un peu,je connais un peu,je connais bien,je connais un peu,je connais un peu,je connais un peu,je connais bien,je connais bien,je connais un peu,je connais un peu,je connais bien,je connais un peu,je connais bien,je connais bien,je connais un peu,je connais un peu,je connais bien,je connais un peu,je connais un peu,je connais un peu,je ne connais pas du tout,je connais un peu,je ne connais pas du tout,je ne connais pas du tout,je connais bien,je connais un peu,je connais un peu,je connais un peu,je ne connais pas du tout,je connais un peu,je connais un peu,je connais un peu,je connais un peu,je connais un peu,je connais bien,je ne connais pas du tout,je connais bien,je connais un peu,je connais bien,je ne connais pas du tout,je connais un peu,je connais bien,je connais un peu,je connais bien,je connais un peu,je connais un peu,je connais bien,je connais bien,je connais bien,je connais un peu,je connais un peu,je connais un peu,je connais un peu,je connais un peu,je connais bien,je connais un peu,je connais un peu,je connais un peu,je connais un peu,je connais un peu,je connais un peu,je connais un peu,je connais un peu,je connais un peu,je connais un peu,je connais un peu,je connais un peu,je connais un peu,je connais un peu,je connais bien,je connais un peu,je ne connais pas du tout,je ne connais pas du tout,je ne connais pas du tout,je ne connais pas du tout,je ne connais pas du tout,je ne connais pas du tout,je ne connais pas du tout,je ne connais pas du tout,je connais un peu,je ne connais pas du tout,je ne connais pas du tout,je ne connais pas du tout,je ne connais pas du tout,je ne connais pas du tout,je ne connais pas du tout,je connais bien,je connais un peu,je connais bien,je connais un peu,je connais bien,je connais bien,je connais bien,je connais bien,je connais un peu,je connais un peu,je connais un peu,je suis accro,souvent,souvent,souvent,souvent,souvent,souvent,rarement,je suis accro,rarement,souvent,souvent,souvent,souvent,souvent,rarement,souvent,rarement,je suis accro,rarement,,je ne connais pas du tout,,je ne connais pas du tout,je ne connais pas du tout,je ne connais pas du tout,je ne connais pas du tout,je suis expert(e),je ne connais pas du tout,je ne connais pas du tout
01/10/2021 15:27:55,Celia,TIBELGHAI,Celia.tibelghai23@gmail.com,20009821,non,M2 AVUN,https://drive.google.com/open?id=1XMLJiQojmS0lolppKd8sB2Mnum23NXFD,Oui,De qualité moyenne,De qualité moyenne,,,Céliatib,Celia_tib,Celia_tib,"Graphiste, Chef de projet, Veille","Chef de projet, Data analyste, Veille, Analyste",M1 GSI,Besoin d'approfondissement,Besoin urgent,Besoin urgent,Besoin d'approfondissement,Pas besoin,Besoin d'approfondissement,Pas besoin,Besoin d'approfondissement,Besoin d'approfondissement,Besoin d'approfondissement,Pas besoin,Pas besoin,Besoin d'approfondissement,Besoin urgent,Besoin urgent,Besoin d'approfondissement,Besoin d'approfondissement,Pas besoin,Pas besoin,Besoin d'approfondissement,Besoin d'approfondissement,Besoin d'approfondissement,Besoin urgent,Besoin urgent,Besoin urgent,Besoin d'approfondissement,Besoin urgent,Besoin urgent,Besoin urgent,je connais un peu,je connais un peu,je connais un peu,je ne connais pas du tout,je ne connais pas du tout,je connais bien,je ne connais pas du tout,je connais un peu,je connais un peu,je connais bien,je connais bien,je connais un peu,je connais bien,je connais bien,je connais un peu,je connais bien,je connais un peu,je connais bien,je connais un peu,je connais bien,je ne connais pas du tout,je connais un peu,je connais un peu,je ne connais pas du tout,je ne connais pas du tout,je connais bien,je connais bien,je ne connais pas du tout,je ne connais pas du tout,je connais un peu,je connais bien,je ne connais pas du tout,je ne connais pas du tout,je connais un peu,je ne connais pas du tout,je ne connais pas du tout,je ne connais pas du tout,je ne connais pas du tout,je connais bien,je connais un peu,je ne connais pas du tout,je connais un peu,je ne connais pas du tout,je ne connais pas du tout,,,,je connais un peu,je connais bien,je connais un peu,je connais un peu,je ne connais pas du tout,je ne connais pas du tout,je connais un peu,je ne connais pas du tout,je ne connais pas du tout,je ne connais pas du tout,je connais bien,je ne connais pas du tout,je connais bien,je connais bien,je ne connais pas du tout,je ne connais pas du tout,je connais un peu,je connais un peu,je connais bien,je ne connais pas du tout,je ne connais pas du tout,je ne connais pas du tout,je ne connais pas du tout,je connais un peu,je connais un peu,je ne connais pas du tout,je ne connais pas du tout,je ne connais pas du tout,je ne connais pas du tout,je ne connais pas du tout,je connais un peu,je ne connais pas du tout,je ne connais pas du tout,je connais un peu,je ne connais pas du tout,je ne connais pas du tout,je ne connais pas du tout,je ne connais pas du tout,je ne connais pas du tout,je ne connais pas du tout,je connais un peu,je ne connais pas du tout,je ne connais pas du tout,je ne connais pas du tout,je ne connais pas du tout,je suis expert(e),je connais un peu,je suis expert(e),je connais un peu,je suis expert(e),je ne connais pas du tout,je ne connais pas du tout,je connais un peu,je ne connais pas du tout,je ne connais pas du tout,je ne connais pas du tout,je ne connais pas du tout,je ne connais pas du tout,je ne connais pas du tout,je ne connais pas du tout,je ne connais pas du tout,je ne connais pas du tout,je suis expert(e),je ne connais pas du tout,je connais un peu,je ne connais pas du tout,je connais un peu,je ne connais pas du tout,je suis expert(e),je connais un peu,je connais un peu,je connais un peu,je ne connais pas du tout,je suis accro,je suis accro,je suis accro,je suis accro,je suis accro,je suis accro,souvent,je suis accro,rarement,rarement,je suis accro,souvent,rarement,souvent,rarement,rarement,rarement,rarement,rarement,jamais,,je ne connais pas du tout,,je ne connais pas du tout,je ne connais pas du tout,je ne connais pas du tout,je ne connais pas du tout,je ne connais pas du tout,je ne connais pas du tout,je ne connais pas du tout
02/10/2021 13:25:59,Aini,BENBALA,ainibenbala@gmail.com,/,mis en favorable,M2 AVUN,https://drive.google.com/open?id=1Wl84pJIzAhG1IfjRFhr5qoenCV6rz37J,Oui,De bonne qualité,De qualité moyenne,,,ainiben,ainiben,ainiben,"Commercial, Analyste, Banques","Concepteur, Chef de projet, Data analyste",Gestion des finances publiques,Besoin d'approfondissement,Besoin d'approfondissement,Besoin d'approfondissement,Besoin d'approfondissement,Besoin d'approfondissement,Besoin d'approfondissement,Besoin d'approfondissement,Besoin d'approfondissement,Besoin d'approfondissement,Besoin d'approfondissement,Besoin d'approfondissement,Besoin d'approfondissement,Besoin d'approfondissement,Besoin d'approfondissement,Besoin d'approfondissement,Besoin d'approfondissement,Besoin d'approfondissement,Besoin d'approfondissement,Besoin d'approfondissement,Besoin d'approfondissement,Besoin d'approfondissement,Besoin d'approfondissement,Besoin d'approfondissement,Besoin d'approfondissement,Besoin d'approfondissement,Besoin d'approfondissement,Besoin d'approfondissement,Besoin d'approfondissement,Besoin d'approfondissement,je connais un peu,je connais un peu,je ne connais pas du tout,je connais un peu,je ne connais pas du tout,je ne connais pas du tout,je ne connais pas du tout,je ne connais pas du tout,je ne connais pas du tout,je ne connais pas du tout,je connais un peu,je ne connais pas du tout,je ne connais pas du tout,je connais un peu,je connais un peu,je ne connais pas du tout,je ne connais pas du tout,je ne connais pas du tout,je ne connais pas du tout,je ne connais pas du tout,je ne connais pas du tout,je connais un peu,je connais un peu,je connais un peu,je connais un peu,je connais un peu,je connais un peu,je ne connais pas du tout,je ne connais pas du tout,je connais un peu,,,,,,,,je connais un peu,,,,,,,je connais un peu,,,je connais un peu,,,,,,je connais un peu,,,je connais un peu,,,je connais bien,,,,je connais un peu,je connais un peu,je connais un peu,je connais bien,je connais un peu,,je ne connais pas du tout,je connais un peu,je connais un peu,je connais un peu,je connais un peu,,je connais un peu,je connais un peu,je connais un peu,,,je connais un peu,,,,,,je connais un peu,je connais un peu,,,,,je connais bien,je connais un peu,je connais bien,,je connais bien,,,,,,,,,,,,,,,,,,,,,je connais un peu,,,souvent,rarement,rarement,souvent,souvent,,rarement,,,,souvent,,,rarement,,,,,,,De bonne qualité,,,,,,,,,
03/10/2021 22:13:15,Salma,Ammari,salma.ammari07@gmail.com,21009369,,M2 THYP,https://drive.google.com/open?id=1FEBbDxFmGmmeFUCixJ4a_OYyawWkohhO,Non,,De qualité moyenne,,,,,,"Développeur, Chef de projet, Commercial, Ingénieur informatique","Chef de projet, Ingénieur informatique",system d'information,Pas besoin,Pas besoin,Besoin urgent,Pas besoin,Pas besoin,Besoin d'approfondissement,Besoin urgent,Besoin urgent,Besoin d'approfondissement,Pas besoin,Pas besoin,Besoin d'approfondissement,Besoin d'approfondissement,Besoin d'approfondissement,Besoin d'approfondissement,Besoin d'approfondissement,Besoin d'approfondissement,Besoin d'approfondissement,Besoin d'approfondissement,Besoin urgent,Besoin d'approfondissement,Besoin d'approfondissement,Pas besoin,Pas besoin,Pas besoin,Pas besoin,Pas besoin,Besoin d'approfondissement,Besoin d'approfondissement,je connais bien,je connais bien,je ne connais pas du tout,je connais bien,je connais bien,je connais bien,je connais un peu,je connais un peu,je connais un peu,je connais bien,je connais bien,je connais bien,je connais bien,,,,,,,,je connais un peu,je connais un peu,je connais bien,je connais bien,,je connais bien,,je connais un peu,je connais un peu,je connais un peu,,,,,,,,je connais bien,je connais bien,,,,,,je connais bien,je connais bien,,je connais bien,,,,,je connais un peu,je connais un peu,,,,,,,,,,je connais un peu,je connais bien,je connais un peu,,,,je connais un peu,je connais bien,je connais bien,je connais bien,je connais bien,je connais bien,je connais un peu,je connais un peu,je connais bien,,,je connais un peu,,,,,,,je connais un peu,,,,,je connais bien,je connais bien,je suis expert(e),,je suis expert(e),,,,,,,,,,,,,je connais un peu,je ne connais pas du tout,je ne connais pas du tout,je ne connais pas du tout,je ne connais pas du tout,je ne connais pas du tout,je ne connais pas du tout,je ne connais pas du tout,je ne connais pas du tout,je ne connais pas du tout,je ne connais pas du tout,je suis accro,je suis accro,je suis accro,je suis accro,je suis accro,jamais,je suis accro,jamais,jamais,jamais,je suis accro,souvent,jamais,rarement,jamais,jamais,jamais,jamais,souvent,jamais,,,,,je connais un peu,,,,,
04/10/2021 09:34:46,Abderrezak,FELIACHI,abderrezak.feliachi@gmail.com,21011240,,M2 THYP,https://drive.google.com/open?id=1S7X48QGKJsAaLBZEJrT7uexz186nD50P,Oui,,De qualité moyenne,,,github.com/AbderrezakFel,,,Développeur,"Développeur, Chef de projet",Master en Informatique  parcours Systèmes d'information & Technologies Web,Pas besoin,Pas besoin,Besoin d'approfondissement,Pas besoin,Besoin d'approfondissement,Besoin d'approfondissement,Besoin d'approfondissement,Besoin d'approfondissement,Besoin d'approfondissement,Besoin d'approfondissement,Besoin d'approfondissement,Besoin d'approfondissement,Besoin d'approfondissement,Besoin d'approfondissement,Besoin d'approfondissement,Besoin d'approfondissement,Besoin d'approfondissement,Besoin d'approfondissement,Besoin d'approfondissement,Besoin d'approfondissement,Besoin d'approfondissement,Besoin d'approfondissement,Besoin d'approfondissement,,Besoin d'approfondissement,Besoin d'approfondissement,Besoin d'approfondissement,Besoin d'approfondissement,Besoin d'approfondissement,je connais bien,je connais bien,je connais un peu,je connais un peu,je connais un peu,je ne connais pas du tout,je ne connais pas du tout,je connais un peu,je ne connais pas du tout,je connais un peu,je connais un peu,je ne connais pas du tout,je connais un peu,je connais un peu,je ne connais pas du tout,je connais un peu,je ne connais pas du tout,je ne connais pas du tout,je ne connais pas du tout,je connais un peu,je connais un peu,je connais un peu,je connais bien,je connais bien,je connais un peu,je connais un peu,je connais un peu,je connais un peu,je connais un peu,je connais un peu,je ne connais pas du tout,je ne connais pas du tout,je ne connais pas du tout,je ne connais pas du tout,je connais bien,je ne connais pas du tout,je ne connais pas du tout,je suis expert(e),je connais bien,je ne connais pas du tout,je ne connais pas du tout,je ne connais pas du tout,je ne connais pas du tout,je ne connais pas du tout,je connais bien,je connais bien,je ne connais pas du tout,je suis expert(e),je connais un peu,je ne connais pas du tout,je ne connais pas du tout,je ne connais pas du tout,je ne connais pas du tout,je ne connais pas du tout,je ne connais pas du tout,je ne connais pas du tout,je ne connais pas du tout,je ne connais pas du tout,je ne connais pas du tout,je connais bien,je ne connais pas du tout,je connais un peu,je ne connais pas du tout,je ne connais pas du tout,je connais bien,je connais un peu,je ne connais pas du tout,je ne connais pas du tout,je ne connais pas du tout,je connais un peu,je connais bien,je connais un peu,je connais bien,je connais un peu,je connais un peu,je ne connais pas du tout,je suis expert(e),je suis expert(e),je ne connais pas du tout,je ne connais pas du tout,je connais bien,je ne connais pas du tout,je ne connais pas du tout,je ne connais pas du tout,je ne connais pas du tout,je ne connais pas du tout,je connais un peu,je connais bien,je connais bien,je connais un peu,je connais un peu,je ne connais pas du tout,je connais bien,je suis expert(e),je suis expert(e),je ne connais pas du tout,je ne connais pas du tout,je ne connais pas du tout,je ne connais pas du tout,je ne connais pas du tout,je ne connais pas du tout,je ne connais pas du tout,je ne connais pas du tout,je ne connais pas du tout,je ne connais pas du tout,je ne connais pas du tout,je ne connais pas du tout,je ne connais pas du tout,je ne connais pas du tout,je connais un peu,je ne connais pas du tout,je ne connais pas du tout,je ne connais pas du tout,je ne connais pas du tout,je ne connais pas du tout,je ne connais pas du tout,je ne connais pas du tout,je ne connais pas du tout,je ne connais pas du tout,je ne connais pas du tout,souvent,souvent,souvent,souvent,souvent,jamais,jamais,rarement,rarement,jamais,souvent,jamais,jamais,rarement,jamais,jamais,jamais,jamais,jamais,jamais,,je ne connais pas du tout,,je ne connais pas du tout,je ne connais pas du tout,je ne connais pas du tout,je ne connais pas du tout,je ne connais pas du tout,je ne connais pas du tout,je ne connais pas du tout
04/10/2021 10:31:37,Aymen,BOUNABI,aymenbounabi24@gmail.com,En cours,non,M2 AVUN,https://drive.google.com/open?id=1-_-ck0NGDbTST9l6ln2f8fzYUCUDiJlv,Oui,De bonne qualité,De bonne qualité,,,aymenbounabi,aymenbnb,,"Développeur, Rédacteur, Ingénieur informatique","Chef de projet, Data analyste, Community manager, Analyste",Systèmes automatiques mobiles,Besoin urgent,Besoin urgent,Besoin d'approfondissement,Besoin d'approfondissement,Besoin d'approfondissement,Pas besoin,Pas besoin,Besoin d'approfondissement,Besoin urgent,Besoin d'approfondissement,Besoin d'approfondissement,Besoin d'approfondissement,Besoin d'approfondissement,Besoin d'approfondissement,Besoin d'approfondissement,Besoin urgent,Besoin urgent,Besoin urgent,Besoin urgent,Besoin d'approfondissement,Besoin d'approfondissement,Besoin d'approfondissement,Besoin d'approfondissement,Besoin d'approfondissement,Pas besoin,Besoin urgent,Besoin d'approfondissement,Pas besoin,Pas besoin,je connais un peu,je connais un peu,je ne connais pas du tout,je ne connais pas du tout,je ne connais pas du tout,je ne connais pas du tout,je ne connais pas du tout,je connais un peu,je connais un peu,je connais un peu,je connais un peu,je connais un peu,je connais un peu,je connais un peu,je connais un peu,je connais un peu,je connais un peu,je ne connais pas du tout,je ne connais pas du tout,je ne connais pas du tout,je ne connais pas du tout,je ne connais pas du tout,je connais un peu,je connais bien,je ne connais pas du tout,je ne connais pas du tout,je connais un peu,je ne connais pas du tout,je ne connais pas du tout,je connais un peu,je connais un peu,je ne connais pas du tout,je ne connais pas du tout,,je ne connais pas du tout,je connais un peu,je connais un peu,je ne connais pas du tout,je ne connais pas du tout,je ne connais pas du tout,je ne connais pas du tout,je ne connais pas du tout,je ne connais pas du tout,je ne connais pas du tout,je ne connais pas du tout,je ne connais pas du tout,,je ne connais pas du tout,je ne connais pas du tout,je ne connais pas du tout,je ne connais pas du tout,je ne connais pas du tout,je ne connais pas du tout,je connais bien,je ne connais pas du tout,je ne connais pas du tout,,je ne connais pas du tout,je ne connais pas du tout,je connais bien,je ne connais pas du tout,je ne connais pas du tout,je suis expert(e),je suis expert(e),je ne connais pas du tout,je connais un peu,je ne connais pas du tout,je ne connais pas du tout,je ne connais pas du tout,je connais un peu,je connais un peu,je ne connais pas du tout,je suis expert(e),je connais bien,je ne connais pas du tout,je connais bien,je connais un peu,je connais bien,je ne connais pas du tout,je ne connais pas du tout,je connais un peu,je ne connais pas du tout,je ne connais pas du tout,je suis expert(e),je ne connais pas du tout,je ne connais pas du tout,je ne connais pas du tout,je ne connais pas du tout,je ne connais pas du tout,je ne connais pas du tout,je ne connais pas du tout,je ne connais pas du tout,je suis expert(e),je connais bien,je suis expert(e),je connais un peu,je connais bien,,,,,,,,,,,,,je ne connais pas du tout,je ne connais pas du tout,je connais un peu,je ne connais pas du tout,je ne connais pas du tout,je ne connais pas du tout,je connais bien,je ne connais pas du tout,je ne connais pas du tout,je ne connais pas du tout,je ne connais pas du tout,souvent,souvent,souvent,souvent,souvent,rarement,jamais,rarement,souvent,souvent,souvent,jamais,jamais,souvent,jamais,rarement,jamais,jamais,jamais,jamais,,,,,je connais un peu,,,,,
