20/09/2021 11:21:26,Yann,HIPPLER,yann.hippler@gmail.com,19012386,,M2 THYP,https://drive.google.com/open?id=1hFhUK613Z9iPmKz5s5jE_9VtrN2xV5Lb,Oui,De bonne qualité,De qualité moyenne,De bonne qualité,Pas utilisé,YanHip,,,"Développeur, Assistant technique","Développeur, Concepteur",M1 Informatique Paris 8,Besoin d'approfondissement,Pas besoin,Besoin d'approfondissement,Besoin d'approfondissement,Besoin d'approfondissement,Besoin d'approfondissement,Pas besoin,Besoin urgent,Pas besoin,Besoin d'approfondissement,Pas besoin,Besoin d'approfondissement,Pas besoin,Besoin d'approfondissement,Pas besoin,Besoin d'approfondissement,Besoin d'approfondissement,Besoin d'approfondissement,Pas besoin,Besoin d'approfondissement,Pas besoin,Pas besoin,Besoin d'approfondissement,Pas besoin,Pas besoin,Pas besoin,Pas besoin,Besoin d'approfondissement,Besoin d'approfondissement,je connais bien,je connais bien,je connais un peu,je connais un peu,je connais un peu,je connais un peu,je ne connais pas du tout,je ne connais pas du tout,je ne connais pas du tout,je connais un peu,je connais un peu,je connais un peu,je connais un peu,je connais un peu,je ne connais pas du tout,je connais un peu,je connais bien,je connais bien,je ne connais pas du tout,je connais un peu,je ne connais pas du tout,je connais un peu,je connais un peu,je connais bien,je connais un peu,je connais un peu,je connais bien,je connais un peu,je connais un peu,je connais un peu,je ne connais pas du tout,je connais un peu,je ne connais pas du tout,je ne connais pas du tout,je ne connais pas du tout,je ne connais pas du tout,je ne connais pas du tout,je connais un peu,je connais bien,je connais un peu,je ne connais pas du tout,je ne connais pas du tout,je connais un peu,je connais un peu,je connais bien,je connais un peu,je connais un peu,je connais bien,je connais un peu,je ne connais pas du tout,je ne connais pas du tout,je connais un peu,je ne connais pas du tout,je connais un peu,je connais un peu,je ne connais pas du tout,je ne connais pas du tout,je ne connais pas du tout,je connais un peu,je connais bien,je connais bien,je ne connais pas du tout,je ne connais pas du tout,je connais un peu,je connais bien,je connais bien,je connais bien,je connais bien,,je connais bien,je connais bien,je connais bien,je connais un peu,je connais un peu,je ne connais pas du tout,je connais un peu,je connais un peu,je connais bien,je ne connais pas du tout,je ne connais pas du tout,je connais un peu,je ne connais pas du tout,je ne connais pas du tout,je ne connais pas du tout,je ne connais pas du tout,je ne connais pas du tout,je connais un peu,je connais bien,je connais bien,je ne connais pas du tout,je ne connais pas du tout,je ne connais pas du tout,je suis expert(e),je connais bien,je ne connais pas du tout,je ne connais pas du tout,je ne connais pas du tout,je ne connais pas du tout,je ne connais pas du tout,je connais un peu,je ne connais pas du tout,je ne connais pas du tout,je connais un peu,je ne connais pas du tout,je ne connais pas du tout,je ne connais pas du tout,je ne connais pas du tout,je ne connais pas du tout,je ne connais pas du tout,je connais un peu,je ne connais pas du tout,je ne connais pas du tout,je ne connais pas du tout,je connais un peu,je connais un peu,je connais un peu,je ne connais pas du tout,je ne connais pas du tout,je ne connais pas du tout,je ne connais pas du tout,souvent,souvent,rarement,souvent,souvent,jamais,souvent,souvent,souvent,jamais,souvent,jamais,jamais,rarement,jamais,jamais,jamais,jamais,jamais,jamais,De bonne qualité,je ne connais pas du tout,,je ne connais pas du tout,je ne connais pas du tout,je ne connais pas du tout,je ne connais pas du tout,je ne connais pas du tout,je ne connais pas du tout,je ne connais pas du tout
20/09/2021 11:21:28,Abdallah,Lahbib,lahbib.3abdallah98@gmail.com,21002759,,M2 THYP,https://drive.google.com/open?id=1oIDHRjMzGjDusVeAzh1Jj-6YQGiWe_O4,Oui,De bonne qualité,De bonne qualité,Pas utilisé,Pas utilisé,Abdallah189,alahbib,,"Développeur, Concepteur, Data analyste","Développeur, Concepteur, Chef de projet",M1 PDCS (parallel and distributed computer science),Besoin d'approfondissement,Besoin d'approfondissement,Besoin d'approfondissement,Besoin d'approfondissement,Besoin d'approfondissement,Besoin d'approfondissement,Besoin d'approfondissement,Besoin d'approfondissement,Besoin d'approfondissement,Besoin d'approfondissement,Besoin d'approfondissement,Besoin d'approfondissement,Besoin d'approfondissement,Besoin d'approfondissement,Besoin d'approfondissement,Besoin d'approfondissement,Besoin d'approfondissement,Besoin d'approfondissement,Besoin d'approfondissement,Besoin d'approfondissement,Besoin d'approfondissement,Besoin d'approfondissement,Besoin urgent,Besoin urgent,Besoin d'approfondissement,Besoin d'approfondissement,Besoin d'approfondissement,Besoin urgent,Besoin urgent,je connais bien,je connais bien,je connais un peu,je connais un peu,je connais un peu,je connais un peu,je ne connais pas du tout,je connais un peu,je connais un peu,je connais bien,je connais bien,je connais bien,je connais bien,je connais bien,je connais bien,je connais un peu,je connais bien,je connais un peu,je connais un peu,je connais bien,je connais bien,je connais bien,je connais bien,je connais bien,je connais un peu,je connais bien,je suis expert(e),je connais un peu,je connais un peu,je ne connais pas du tout,je connais un peu,je connais un peu,je connais un peu,je ne connais pas du tout,je ne connais pas du tout,je ne connais pas du tout,je connais un peu,je connais bien,je connais bien,je connais bien,je ne connais pas du tout,je ne connais pas du tout,je ne connais pas du tout,je connais un peu,je connais bien,je connais bien,je connais bien,je connais bien,je connais bien,je connais bien,je connais un peu,je connais un peu,je connais un peu,je connais bien,je connais bien,je connais bien,je connais bien,je connais bien,je connais un peu,je connais un peu,je connais bien,je connais bien,je connais bien,je connais bien,je connais bien,je connais bien,je connais bien,je connais bien,je connais un peu,je connais bien,je connais bien,je connais bien,je connais bien,je connais bien,je connais bien,je connais bien,je connais bien,je connais bien,je connais un peu,je connais un peu,je connais bien,je connais un peu,je connais un peu,je connais bien,je ne connais pas du tout,je ne connais pas du tout,je connais bien,je connais bien,je connais bien,je ne connais pas du tout,je ne connais pas du tout,je connais bien,je connais bien,je connais bien,je connais bien,je ne connais pas du tout,je ne connais pas du tout,je ne connais pas du tout,je ne connais pas du tout,je ne connais pas du tout,je ne connais pas du tout,je ne connais pas du tout,je ne connais pas du tout,je ne connais pas du tout,je ne connais pas du tout,je ne connais pas du tout,je ne connais pas du tout,je ne connais pas du tout,je ne connais pas du tout,je connais un peu,je ne connais pas du tout,je connais un peu,je ne connais pas du tout,je ne connais pas du tout,je ne connais pas du tout,je ne connais pas du tout,je ne connais pas du tout,je ne connais pas du tout,je connais un peu,je ne connais pas du tout,souvent,rarement,souvent,souvent,souvent,jamais,rarement,souvent,souvent,rarement,souvent,rarement,rarement,souvent,rarement,rarement,jamais,jamais,jamais,jamais,Pas utilisé,je ne connais pas du tout,,je ne connais pas du tout,je ne connais pas du tout,je ne connais pas du tout,je ne connais pas du tout,je ne connais pas du tout,je ne connais pas du tout,je ne connais pas du tout
20/09/2021 11:23:42,ismail,mernissi arifi,mernissi_mernissi@hotmail.fr,21009166,,M2 THYP,https://drive.google.com/open?id=1tYYMMXoeooFP7QPDfunzg4AWACuP44dQ,Oui,Pas utilisé,De qualité moyenne,Pas utilisé,Pas utilisé,ismailmernissi,ismailmernissi,ismailmernissi,"Développeur, Concepteur","Chef de projet, Data analyste, Veille",M1-Ingénierie des systèmes d'information (ESISA),Besoin d'approfondissement,Besoin d'approfondissement,,Besoin d'approfondissement,Besoin d'approfondissement,Besoin d'approfondissement,Besoin d'approfondissement,Besoin d'approfondissement,Besoin d'approfondissement,Besoin d'approfondissement,Besoin d'approfondissement,Besoin d'approfondissement,Besoin d'approfondissement,Besoin d'approfondissement,Besoin d'approfondissement,Besoin d'approfondissement,Besoin d'approfondissement,Besoin d'approfondissement,Besoin d'approfondissement,,Besoin d'approfondissement,Besoin d'approfondissement,Besoin d'approfondissement,Besoin d'approfondissement,Besoin d'approfondissement,Besoin d'approfondissement,Besoin d'approfondissement,Besoin d'approfondissement,Besoin d'approfondissement,je connais un peu,je connais un peu,je connais un peu,je connais un peu,je connais un peu,je connais un peu,je ne connais pas du tout,je connais un peu,je connais un peu,je connais bien,je connais un peu,je connais un peu,je connais un peu,je ne connais pas du tout,,je connais un peu,je connais bien,je connais un peu,je ne connais pas du tout,je connais bien,je connais un peu,je connais bien,je connais bien,je connais bien,je connais un peu,je connais bien,je connais un peu,je ne connais pas du tout,je ne connais pas du tout,je connais un peu,je ne connais pas du tout,je ne connais pas du tout,je ne connais pas du tout,je ne connais pas du tout,je ne connais pas du tout,je ne connais pas du tout,je connais un peu,je connais bien,je connais bien,je ne connais pas du tout,je ne connais pas du tout,je ne connais pas du tout,je ne connais pas du tout,je connais un peu,je connais bien,je connais bien,je connais bien,je connais bien,je connais un peu,je ne connais pas du tout,je ne connais pas du tout,je ne connais pas du tout,je connais un peu,je connais bien,je ne connais pas du tout,je ne connais pas du tout,je connais un peu,je ne connais pas du tout,je ne connais pas du tout,je connais bien,je ne connais pas du tout,je connais un peu,je ne connais pas du tout,je connais un peu,je connais bien,je connais un peu,je ne connais pas du tout,je connais un peu,je ne connais pas du tout,je connais bien,je connais bien,je connais bien,je connais bien,je connais bien,je connais bien,je connais bien,je connais bien,je connais bien,je ne connais pas du tout,je ne connais pas du tout,je connais bien,je connais bien,je ne connais pas du tout,je ne connais pas du tout,je ne connais pas du tout,je ne connais pas du tout,je ne connais pas du tout,je connais bien,je connais un peu,je ne connais pas du tout,je ne connais pas du tout,je ne connais pas du tout,je connais bien,je connais bien,je connais bien,je connais un peu,,,,,,,,,,,,,,je connais bien,je ne connais pas du tout,je ne connais pas du tout,je ne connais pas du tout,je ne connais pas du tout,je ne connais pas du tout,je ne connais pas du tout,je ne connais pas du tout,je ne connais pas du tout,je ne connais pas du tout,je connais un peu,souvent,rarement,souvent,souvent,souvent,rarement,rarement,rarement,rarement,souvent,souvent,jamais,rarement,rarement,jamais,rarement,jamais,jamais,rarement,jamais,Pas utilisé,,,,,,,,,
20/09/2021 11:27:05,Raja,Lamgarmel chammi,lamgarmel.raja@gmail.com,20015158,,M2 THYP,https://drive.google.com/open?id=1Kiy7pO2_RaPd0zpOLrnqvG45nu3aMWyP,Oui,De bonne qualité,,,,Raja lamgarmel,,,Développeur,Développeur,M1 informatique,Pas besoin,Pas besoin,Besoin d'approfondissement,Pas besoin,Pas besoin,Besoin d'approfondissement,,Besoin d'approfondissement,Pas besoin,Pas besoin,Pas besoin,Besoin d'approfondissement,Pas besoin,Besoin d'approfondissement,Besoin d'approfondissement,Pas besoin,Pas besoin,Pas besoin,Besoin d'approfondissement,Pas besoin,Besoin d'approfondissement,Pas besoin,Pas besoin,Pas besoin,Besoin d'approfondissement,Pas besoin,Pas besoin,Besoin d'approfondissement,Besoin d'approfondissement,je connais bien,je connais bien,je ne connais pas du tout,je connais bien,je connais bien,je connais un peu,je ne connais pas du tout,je ne connais pas du tout,je connais bien,je connais bien,je connais bien,je ne connais pas du tout,je connais bien,,je ne connais pas du tout,je connais bien,je connais bien,je connais bien,je ne connais pas du tout,je connais bien,je ne connais pas du tout,je connais bien,je connais bien,je connais bien,je connais bien,je connais bien,je connais bien,je ne connais pas du tout,je ne connais pas du tout,,je connais un peu,je connais un peu,,je connais bien,,,,,,,,,,,,,,,,,,je connais bien,je connais bien,je connais bien,,je connais bien,,,,je connais bien,,,,je connais un peu,je connais bien,je connais bien,,,,je connais bien,,je connais bien,je connais bien,je connais bien,je connais un peu,je connais bien,je connais bien,je connais bien,,,je connais bien,je connais un peu,je connais bien,,,,,je connais bien,,,,,je connais bien,je connais bien,je suis expert(e),,,,,,,,,,,,,,,je connais bien,,je connais bien,,,,je connais bien,,,,,je suis accro,jamais,je suis accro,je suis accro,je suis accro,,je suis accro,,,,je suis accro,,,je suis accro,,,,,,,,,,,,,,,,
20/09/2021 11:29:07,Mouatez Billah,Khalfaoui,khalfaouimouatezbillah@gmail.com,0,,M2 THYP,https://drive.google.com/open?id=1WT5yoR-cFOgIP76AiSDWQSUZQkZfx8MP,Oui,Pas utilisé,De qualité moyenne,Pas utilisé,Pas utilisé,Mouatez96,mouatez96,Mouatez96,Développeur,Développeur,Marketing Digital & UX,Besoin d'approfondissement,Pas besoin,Besoin d'approfondissement,Besoin d'approfondissement,Besoin urgent,Besoin urgent,Besoin urgent,Besoin urgent,Besoin urgent,Besoin urgent,Besoin urgent,Besoin urgent,,,Besoin urgent,Pas besoin,Besoin d'approfondissement,Besoin d'approfondissement,Pas besoin,Besoin urgent,Besoin urgent,Besoin urgent,Besoin d'approfondissement,Besoin d'approfondissement,Besoin d'approfondissement,Besoin d'approfondissement,Besoin d'approfondissement,Besoin d'approfondissement,Besoin d'approfondissement,je connais bien,je connais bien,je connais un peu,je connais un peu,je ne connais pas du tout,je ne connais pas du tout,je ne connais pas du tout,je ne connais pas du tout,je ne connais pas du tout,je ne connais pas du tout,je ne connais pas du tout,je ne connais pas du tout,je ne connais pas du tout,je ne connais pas du tout,je ne connais pas du tout,je connais un peu,je ne connais pas du tout,je ne connais pas du tout,je ne connais pas du tout,je ne connais pas du tout,je ne connais pas du tout,je ne connais pas du tout,je ne connais pas du tout,je connais un peu,je ne connais pas du tout,je ne connais pas du tout,je connais un peu,je connais un peu,je connais un peu,je ne connais pas du tout,je ne connais pas du tout,je ne connais pas du tout,je ne connais pas du tout,je ne connais pas du tout,je ne connais pas du tout,je ne connais pas du tout,je ne connais pas du tout,je connais bien,je connais bien,je ne connais pas du tout,je ne connais pas du tout,je ne connais pas du tout,je ne connais pas du tout,je ne connais pas du tout,je connais un peu,je connais un peu,je connais un peu,je connais un peu,je ne connais pas du tout,je ne connais pas du tout,je ne connais pas du tout,je ne connais pas du tout,je ne connais pas du tout,je ne connais pas du tout,je ne connais pas du tout,je ne connais pas du tout,,je ne connais pas du tout,je ne connais pas du tout,je connais un peu,je connais un peu,je ne connais pas du tout,je ne connais pas du tout,je ne connais pas du tout,je connais bien,je connais un peu,je ne connais pas du tout,je connais un peu,je ne connais pas du tout,je connais bien,je connais bien,je connais bien,je connais un peu,je connais un peu,je ne connais pas du tout,je ne connais pas du tout,je connais bien,je connais bien,je ne connais pas du tout,je ne connais pas du tout,je connais un peu,je ne connais pas du tout,je ne connais pas du tout,je ne connais pas du tout,je ne connais pas du tout,je ne connais pas du tout,je ne connais pas du tout,je connais un peu,je connais un peu,je ne connais pas du tout,je ne connais pas du tout,je ne connais pas du tout,je connais bien,je connais un peu,je suis expert(e),je ne connais pas du tout,je ne connais pas du tout,je ne connais pas du tout,je ne connais pas du tout,je ne connais pas du tout,je ne connais pas du tout,je ne connais pas du tout,je ne connais pas du tout,je ne connais pas du tout,je ne connais pas du tout,je ne connais pas du tout,je ne connais pas du tout,je ne connais pas du tout,je ne connais pas du tout,je connais un peu,je ne connais pas du tout,je ne connais pas du tout,je ne connais pas du tout,je ne connais pas du tout,je ne connais pas du tout,je ne connais pas du tout,je ne connais pas du tout,je ne connais pas du tout,je ne connais pas du tout,je ne connais pas du tout,souvent,jamais,souvent,souvent,rarement,jamais,jamais,souvent,jamais,jamais,souvent,jamais,jamais,jamais,jamais,jamais,jamais,jamais,jamais,jamais,Pas utilisé,je ne connais pas du tout,,je ne connais pas du tout,je connais un peu,je ne connais pas du tout,je ne connais pas du tout,je ne connais pas du tout,je ne connais pas du tout,je ne connais pas du tout
20/09/2021 11:31:51,Asalas,Achat,achsls9206@gmail.com,0,,M2 THYP,https://drive.google.com/open?id=1p0ajvY66cTYbruSbAf24gCITNlDlXL3L,Oui,De qualité moyenne,De bonne qualité,,,Achsalsa,0,0,"Graphiste, Développeur, Concepteur, Ingénieur informatique","Graphiste, Développeur, Concepteur, Ingénieur informatique",Dev full stack et administration reseaux,Pas besoin,Pas besoin,Besoin d'approfondissement,Pas besoin,Pas besoin,Pas besoin,Pas besoin,Pas besoin,Pas besoin,Pas besoin,Pas besoin,Besoin d'approfondissement,Besoin d'approfondissement,Besoin d'approfondissement,Besoin d'approfondissement,Pas besoin,Pas besoin,,Pas besoin,Besoin d'approfondissement,Besoin d'approfondissement,Besoin urgent,Pas besoin,Pas besoin,Besoin d'approfondissement,Besoin d'approfondissement,Besoin d'approfondissement,Pas besoin,Pas besoin,je suis expert(e),je suis expert(e),je connais bien,je connais bien,je connais un peu,je connais un peu,je ne connais pas du tout,je ne connais pas du tout,je ne connais pas du tout,je connais un peu,je connais un peu,je ne connais pas du tout,je ne connais pas du tout,je ne connais pas du tout,je ne connais pas du tout,je connais un peu,je connais un peu,je connais un peu,je ne connais pas du tout,je connais bien,je connais bien,je ne connais pas du tout,je connais bien,je connais bien,je connais un peu,je connais un peu,je connais un peu,je connais bien,je connais bien,je connais bien,je connais un peu,,,je connais bien,je ne connais pas du tout,je connais un peu,je connais un peu,je connais bien,je suis expert(e),je connais un peu,je ne connais pas du tout,je connais un peu,je ne connais pas du tout,je connais un peu,je suis expert(e),je suis expert(e),je suis expert(e),je suis expert(e),je ne connais pas du tout,je connais un peu,je suis expert(e),je connais un peu,je ne connais pas du tout,je connais un peu,je connais un peu,je connais un peu,je connais un peu,je ne connais pas du tout,je ne connais pas du tout,je connais bien,je connais bien,je ne connais pas du tout,je ne connais pas du tout,je ne connais pas du tout,je suis expert(e),je connais bien,je suis expert(e),je suis expert(e),je ne connais pas du tout,je connais bien,je suis expert(e),je suis expert(e),je connais un peu,je connais un peu,je ne connais pas du tout,je connais un peu,je connais un peu,je connais un peu,je ne connais pas du tout,je ne connais pas du tout,je connais bien,je ne connais pas du tout,je ne connais pas du tout,je ne connais pas du tout,je ne connais pas du tout,je ne connais pas du tout,je connais bien,je connais un peu,je connais bien,je ne connais pas du tout,je ne connais pas du tout,je ne connais pas du tout,je connais bien,je connais bien,je suis expert(e),,je suis expert(e),je connais un peu,,je connais un peu,,,,,,,,,,je connais bien,,je connais un peu,,,,,,,,je connais un peu,souvent,souvent,souvent,souvent,souvent,rarement,,rarement,,,,,rarement,rarement,,,,,rarement,,,,,,,,,,,
20/09/2021 11:33:40,Manel,AISSAT,aissat.manel@outlook.fr,0,,M2 THYP,https://drive.google.com/open?id=1ArCcwzrQuYijGKGk9894bwTFqHqoly-R,Oui,De bonne qualité,De bonne qualité,,,NEL18,,,Développeur,"Développeur, Chef de projet",Master 1 informatique ,Besoin d'approfondissement,Besoin d'approfondissement,,,,,Besoin urgent,,Besoin d'approfondissement,Besoin d'approfondissement,,Besoin d'approfondissement,Besoin d'approfondissement,Besoin d'approfondissement,Besoin urgent,Besoin d'approfondissement,Besoin urgent,Besoin d'approfondissement,,Besoin d'approfondissement,Besoin d'approfondissement,Besoin d'approfondissement,,,,,Besoin d'approfondissement,,,je connais bien,je connais bien,je ne connais pas du tout,je connais bien,je connais un peu,,je ne connais pas du tout,je connais un peu,je ne connais pas du tout,,,,,,je ne connais pas du tout,,je ne connais pas du tout,je ne connais pas du tout,je ne connais pas du tout,je connais bien,,,,,,je connais bien,,je ne connais pas du tout,je ne connais pas du tout,je ne connais pas du tout,je ne connais pas du tout,je ne connais pas du tout,je ne connais pas du tout,je ne connais pas du tout,je ne connais pas du tout,je ne connais pas du tout,je ne connais pas du tout,je connais bien,je connais bien,je ne connais pas du tout,je ne connais pas du tout,je ne connais pas du tout,je ne connais pas du tout,je ne connais pas du tout,je connais bien,je connais bien,je connais bien,je connais bien,je connais un peu,je ne connais pas du tout,je ne connais pas du tout,je ne connais pas du tout,je connais un peu,je connais bien,je ne connais pas du tout,je ne connais pas du tout,je ne connais pas du tout,je ne connais pas du tout,je ne connais pas du tout,je ne connais pas du tout,je ne connais pas du tout,je connais un peu,je ne connais pas du tout,je connais un peu,je connais bien,je connais bien,je connais un peu,je connais un peu,je ne connais pas du tout,je connais bien,je connais bien,je connais bien,je connais bien,je connais bien,je connais bien,je connais bien,je connais bien,je connais bien,je ne connais pas du tout,je ne connais pas du tout,je connais bien,je ne connais pas du tout,je ne connais pas du tout,je ne connais pas du tout,je connais un peu,je ne connais pas du tout,,je connais un peu,je connais un peu,je ne connais pas du tout,je ne connais pas du tout,je ne connais pas du tout,je suis expert(e),je connais bien,je suis expert(e),,je suis expert(e),,,,,,,,,,,,,je connais un peu,je ne connais pas du tout,je ne connais pas du tout,je ne connais pas du tout,je ne connais pas du tout,je ne connais pas du tout,je connais bien,je ne connais pas du tout,je ne connais pas du tout,je ne connais pas du tout,je ne connais pas du tout,souvent,jamais,souvent,souvent,souvent,jamais,souvent,souvent,jamais,jamais,souvent,jamais,jamais,rarement,jamais,jamais,jamais,jamais,souvent,jamais,,,,,,,,,,
20/09/2021 11:34:06,Youssouf,DABO,youssoufdabo2@gmail.com,18910138,,M2 THYP,https://drive.google.com/open?id=14ZD4ZDkkuP1-4RWrcP_78yhrUMEmrloj,Oui,De bonne qualité,De bonne qualité,De bonne qualité,Pas utilisé,Youssoufyouss,Youssoufyouss,,"Développeur, Concepteur, Assistant technique","Développeur, Concepteur, Assistant technique",Master 1 Informatique,Pas besoin,Pas besoin,Besoin d'approfondissement,Pas besoin,Besoin d'approfondissement,Besoin d'approfondissement,Pas besoin,Pas besoin,Besoin d'approfondissement,Besoin urgent,Besoin d'approfondissement,Besoin d'approfondissement,Pas besoin,Pas besoin,Pas besoin,Pas besoin,Besoin urgent,Besoin d'approfondissement,Pas besoin,Besoin d'approfondissement,Besoin d'approfondissement,Besoin d'approfondissement,Besoin d'approfondissement,Besoin d'approfondissement,Besoin d'approfondissement,Besoin d'approfondissement,Besoin d'approfondissement,Besoin d'approfondissement,Besoin d'approfondissement,je connais bien,je connais bien,je connais bien,je connais bien,je connais un peu,je connais un peu,je connais bien,je connais bien,je connais un peu,je connais un peu,je connais bien,je connais bien,je connais bien,je connais bien,je connais un peu,je connais bien,je connais un peu,je connais un peu,je connais un peu,je connais un peu,je connais un peu,je connais un peu,je connais bien,je connais un peu,je connais bien,je connais un peu,je connais bien,je connais un peu,je connais un peu,je connais bien,je connais un peu,je connais un peu,je connais un peu,je connais un peu,je connais un peu,je connais un peu,je connais bien,je connais un peu,je connais bien,je connais un peu,je connais bien,je connais bien,je connais un peu,je connais un peu,je connais bien,je connais bien,je connais bien,je connais bien,je connais bien,je connais un peu,je connais bien,je connais bien,je connais bien,je connais un peu,je connais un peu,je connais un peu,je connais un peu,je connais un peu,je connais un peu,je connais bien,je connais un peu,je connais un peu,je connais un peu,je connais un peu,je connais bien,je connais bien,je connais bien,je connais bien,je connais un peu,je connais bien,je connais bien,je connais bien,je connais bien,je connais un peu,je connais un peu,je connais un peu,je connais un peu,je connais bien,je connais un peu,je connais un peu,je connais bien,je connais un peu,je connais un peu,je connais un peu,je connais un peu,je connais un peu,je connais un peu,je connais bien,je connais bien,je connais un peu,je connais un peu,je connais un peu,je suis expert(e),je connais bien,je connais un peu,,,,,,,,,,,,,je connais un peu,,je connais bien,je connais bien,,,je connais bien,,,,,,,souvent,souvent,souvent,souvent,,,souvent,,,,,,,,,,,,,,De bonne qualité,,,,,,je connais un peu,,,
