Horodateur,Votre prénom,Votre nom,Votre mail,N° étudiant,inscrit ent,Dans quel parcours êtes vous inscris ?,Votre photo,Avez-vous un ordinateur personnel pour suivre les cours ?,Votre connexion internet personnelle est : [WIFI],Votre connexion internet personnelle est : [4G],Votre connexion internet personnelle est : [Ethernet],Votre connexion internet personnelle est : [Satellite],Votre compte GitHub,Votre compte Diigo,Votre compte Zotero,Vos spécialités,Vos objectifs professionnels,Votre formation précédente,"Quels sont vos besoins ? [connaître les outils d’édition web (éditeurs html, CSS, …) ]",Quels sont vos besoins ? [connaître les base du langage HTML 5],Quels sont vos besoins ? [connaître les bases du responsive web design (RWD)],Quels sont vos besoins ? [savoir scénariser et réaliser les rubriques « statiques » d’un site web],"Quels sont vos besoins ? [savoir scénariser et réaliser des rubriques multimédias (« page vidéo », « page photo », exposition virtuelle, …)]",Quels sont vos besoins ? [savoir utiliser des cartes géographiques interactives],Quels sont vos besoins ? [savoir travailler avec le RSS],Quels sont vos besoins ? [savoir utiliser correctement les métadonnées pour une meilleure diffusion des contenus du site],Quels sont vos besoins ? [savoir utiliser les programmes de liens sponsorisés],"Quels sont vos besoins ? [savoir utiliser des outils de gestion d’accès aux rubriques (accès par mot de passe, …)]",Quels sont vos besoins ? [savoir mettre en place et gérer un forum de discussion],Quels sont vos besoins ? [savoir mettre en place et gérer un service de type « newsletter » (impliquant la mise en place et la gestion d’un annuaire d’abonnés)],Quels sont vos besoins ? [savoir mettre en place des enquêtes],Quels sont vos besoins ? [savoir mettre en place et exploiter des outils de veille d’information],Quels sont vos besoins ? [savoir mettre en place des outils de type « ranking »],"Quels sont vos besoins ? [savoir intégrer, dans un page, des outils de diffusion web 2 (twitter, facebook, …)]","Quels sont vos besoins ? [savoir faire fonctionner, sur un site, un service de type « e-commerce » (vente de produits, …)]","Quels sont vos besoins ? [savoir réaliser et diffuser des e-publications : brochures, dépliants, publications multimédias, …]",Quels sont vos besoins ? [savoir réaliser des podcasts],Quels sont vos besoins ? [savoir gérer la publication à distance d’un site web],Quels sont vos besoins ? [savoir gérer un site multilingue],Quels sont vos besoins ? [savoir gérer une communauté en ligne],Quels sont vos besoins ? [analyser des bases de données],Quels sont vos besoins ? [modéliser des bases de données],Quels sont vos besoins ? [savoir prototyper des innovations numériques],Quels sont vos besoins ? [savoir gérer un projet],Quels sont vos besoins ? [utiliser les méthodes agiles de développement],Quels sont vos besoins ? [concevoir des UX],Quels sont vos besoins ? [concevoir des UI],"Quelles sont vos compétences ? [connaître les outils d’édition web (éditeurs html, CSS, …) ]",Quelles sont vos compétences ? [connaître les base du langage HTML 5],Quelles sont vos compétences ? [connaître les bases du responsive web design (RWD)],Quelles sont vos compétences ? [savoir scénariser et réaliser les rubriques « statiques » d’un site web],"Quelles sont vos compétences ? [savoir scénariser et réaliser des rubriques multimédias (« page vidéo », « page photo », exposition virtuelle, …)]",Quelles sont vos compétences ? [savoir utiliser des cartes géographiques interactives],Quelles sont vos compétences ? [savoir travailler avec le RSS],Quelles sont vos compétences ? [savoir utiliser correctement les métadonnées pour une meilleure diffusion des contenus du site],Quelles sont vos compétences ? [savoir utiliser les programmes de liens sponsorisés],"Quelles sont vos compétences ? [savoir utiliser des outils de gestion d’accès aux rubriques (accès par mot de passe, …)]",Quelles sont vos compétences ? [savoir mettre en place et gérer un forum de discussion],Quelles sont vos compétences ? [savoir mettre en place et gérer un service de type « newsletter » (impliquant la mise en place et la gestion d’un annuaire d’abonnés)],Quelles sont vos compétences ? [savoir mettre en place des enquêtes enligne],Quelles sont vos compétences ? [savoir mettre en place et exploiter des outils de veille d’information],Quelles sont vos compétences ? [savoir mettre en place des outils de type « ranking »],"Quelles sont vos compétences ? [savoir intégrer, dans un page, des outils de diffusion web 2 (twitter, facebook, …)]","Quelles sont vos compétences ? [savoir faire fonctionner, sur un site, un service de type « e-commerce » (vente de produits, …)]","Quelles sont vos compétences ? [savoir réaliser et diffuser des e-publications : brochures, dépliants, publications multimédias, …]",Quelles sont vos compétences ? [savoir réaliser des podcasts],Quelles sont vos compétences ? [savoir gérer la publication à distance d’un site web],Quelles sont vos compétences ? [savoir gérer un site multilingue],Quelles sont vos compétences ? [savoir gérer une communauté en ligne],Quelles sont vos compétences ? [analyser des bases de données],Quelles sont vos compétences ? [modéliser une base de données],Quelles sont vos compétences ? [savoir prototyper des innovations numériques],Quelles sont vos compétences ? [savoir gérer un projet],Quelles sont vos compétences ? [utiliser les méthodes agiles de développement],Quelles sont vos compétences ? [concevoir des UX],Quelles sont vos compétences ? [concevoir des UI],Quelles outils utilisez vous ? [Photoshop],Quelles outils utilisez vous ? [Illustrator],Quelles outils utilisez vous ? [Gimp],Quelles outils utilisez vous ? [Inkscape],Quelles outils utilisez vous ? [Dreamweaver],Quelles outils utilisez vous ? [Kompozer],Quelles outils utilisez vous ? [Premier],Quelles outils utilisez vous ? [After Effect],Quelles outils utilisez vous ? [Eclipse],Quelles outils utilisez vous ? [Sublime text],Quelles outils utilisez vous ? [In design],Quelles outils utilisez vous ? [Final Cut],Quelles outils utilisez vous ? [Blender],Quelles outils utilisez vous ? [Sketchup],Quelles outils utilisez vous ? [Unity],Quelles outils utilisez vous ? [Wamp],Quelles outils utilisez vous ? [Xamp],Quelles outils utilisez vous ? [Mamp],Quelles outils utilisez vous ? [PhpMyAdmin],Quelles outils utilisez vous ? [MySqlWorkbench],Quelles outils utilisez vous ? [Cordova],Quelles outils utilisez vous ? [Bracket],Quelles outils utilisez vous ? [Flash],Quelles outils utilisez vous ? [R],Quelles outils utilisez vous ? [Python],Quelles outils utilisez vous ? [CRM entreprise],Quelles outils utilisez vous ? [SLACK],Quelles outils utilisez vous ? [Talent],Quelles outils utilisez vous ? [Tableau],Quelles outils utilisez vous ? [Balsamique],Quelles outils utilisez vous ? [Office],Quelles outils utilisez vous ? [Trello],Quelles outils utilisez vous ? [Gantt],Quelles outils utilisez vous ? [LaTek],Quelles outils utilisez vous ? [Matlab],Quelles outils utilisez vous ? [Visual Studio],Quelles outils utilisez vous ? [GitHub],Quelles outils utilisez vous ? [Filezilla],Quelles outils utilisez vous ? [FTP],Quelles outils utilisez vous ? [Emacs],Langages [Javascript],Langages [HTML],Langages [CSS],Langages [C],Langages [C++],Langages [C#],Langages [Python],Langages [JAVA],Langages [SQL],Langages [LISP],Langages [Smaltack],Langages [PHP],Langages [Visual Basic],Langages [Scratch],Langages [LaTek],Langages [Markdown],Langages [scala],Langages [CSV],Langages [XML],Langages [JSON],Langages [RDF],Langages [OWL],Langages [ML (TensorFlow)],Langues [Français],Langues [Anglais],Langues [Arabe],Langues [Espagnol],Langues [Tamazirth],Langues [Italien],Langues [Portugais],Langues [Allemand],Langues [Persan],Langues [Russe],Langues [Chinois],Langues [Japonais],Langues [Elefen],Langues [Elfique],Langues [Norvégien],Langues [Bambara],Langues [Tamoul],CMS [Wordpress],CMS [SPIP],CMS [Joomla],CMS [LMS],CMS [Omeka classique],CMS [Omeka S],CMS [Moodle],CMS [Alfresco],CMS [Sharepoint],CMS [Presta shop],CMS [Drupal],Quels réseaux sociaux [Facebook],Quels réseaux sociaux [Twitter],Quels réseaux sociaux [LinkedIn],Quels réseaux sociaux [instagram],Quels réseaux sociaux [what's app],Quels réseaux sociaux [pinterest],Quels réseaux sociaux [snapchat],Quels réseaux sociaux [discord],Quels réseaux sociaux [telegram],Quels réseaux sociaux [Recherche Gate],Quels réseaux sociaux [Youtube],Quels réseaux sociaux [Viadeo],Quels réseaux sociaux [Vimeo],Quels réseaux sociaux [Skype],Quels réseaux sociaux [Sky blog],Quels réseaux sociaux [MSN],Quels réseaux sociaux [Blogs],Quels réseaux sociaux [Signal],Quels réseaux sociaux [TikTok],Quels réseaux sociaux [Line],Votre connexion internet personnelle est : [Fibre],Langues [Hébreux],Langues [Ligne 19],Langues [Laotien],Langues [Turc],Langues [Hindi],Langues [Grec],Langues [Vietnamien],Langues [Pular],Langues [Créole]
20/09/2021 11:07:48,Nabil,DJERDI,djerdi07@gmail.com,18911509,,M2 THYP,https://drive.google.com/open?id=1pFTlUXApTiU63kwqEM3DTos3l-Bfb1YV,Oui,De bonne qualité,De bonne qualité,,,djnabil,dj_nabil,,"Développeur, Chef de projet, Ingénieur informatique","Développeur, Chef de projet, Data analyste, Ingénieur informatique",M1 informatique,Besoin d'approfondissement,Besoin d'approfondissement,Besoin d'approfondissement,Besoin d'approfondissement,,Pas besoin,Pas besoin,Besoin d'approfondissement,Besoin d'approfondissement,Besoin d'approfondissement,Besoin d'approfondissement,Besoin d'approfondissement,Besoin d'approfondissement,Besoin d'approfondissement,Besoin d'approfondissement,Besoin d'approfondissement,Besoin d'approfondissement,Besoin d'approfondissement,Besoin d'approfondissement,Besoin d'approfondissement,Besoin d'approfondissement,Besoin d'approfondissement,Besoin d'approfondissement,Besoin d'approfondissement,Besoin d'approfondissement,Besoin d'approfondissement,Besoin d'approfondissement,Besoin d'approfondissement,Besoin d'approfondissement,je connais bien,je connais bien,je connais un peu,je connais bien,je connais un peu,je connais bien,je connais un peu,je connais bien,je connais bien,je connais bien,je connais bien,je connais bien,je connais bien,je connais bien,je connais bien,je connais bien,je connais bien,je connais bien,je connais bien,je connais bien,je connais bien,je connais bien,je connais bien,je connais bien,je connais bien,je connais bien,je connais bien,je connais un peu,je connais un peu,je connais bien,je connais un peu,je connais un peu,je connais un peu,je connais un peu,je connais un peu,je connais un peu,je connais un peu,je connais bien,je connais bien,je connais un peu,je connais un peu,je connais un peu,je connais un peu,je connais un peu,je connais bien,je connais bien,je connais bien,je connais bien,je connais bien,je connais un peu,je connais un peu,je connais un peu,je ne connais pas du tout,je connais un peu,je connais bien,je connais un peu,je connais un peu,je connais un peu,je connais un peu,je connais un peu,je connais un peu,je connais un peu,je connais un peu,je connais bien,je connais bien,je connais bien,je connais bien,je connais bien,je connais un peu,je connais bien,je connais bien,je connais bien,je connais bien,je connais un peu,je connais un peu,je connais un peu,je connais bien,je connais bien,je ne connais pas du tout,je ne connais pas du tout,je connais un peu,je connais un peu,je ne connais pas du tout,je ne connais pas du tout,je ne connais pas du tout,je connais un peu,je connais bien,je connais bien,je connais bien,je connais un peu,je connais un peu,je connais un peu,je suis expert(e),je connais bien,je connais bien,,je suis expert(e),,,,,,,,,,,,,,,,,,,,,,,,souvent,souvent,souvent,souvent,souvent,rarement,rarement,souvent,rarement,rarement,souvent,rarement,rarement,souvent,souvent,rarement,rarement,rarement,rarement,rarement,,,,,,,,,,
20/09/2021 11:15:22,Aghiles,SAAL,aghilesaghiles3@gmail.com,21010441,,M2 THYP,https://drive.google.com/open?id=15hrCfylbl82-Y1kxBqjdXihs7yh17hts,Oui,,De qualité moyenne,,,dev-aghiles,dev-aghiles,,"Développeur, Chef de projet",Chef de projet,,Besoin d'approfondissement,Besoin d'approfondissement,Besoin urgent,Besoin d'approfondissement,Pas besoin,Pas besoin,Besoin d'approfondissement,Besoin d'approfondissement,Besoin urgent,Besoin urgent,Besoin urgent,Besoin urgent,Besoin urgent,Besoin urgent,Besoin urgent,Besoin d'approfondissement,Besoin d'approfondissement,Besoin d'approfondissement,Besoin urgent,Besoin d'approfondissement,Besoin urgent,Besoin urgent,Besoin urgent,Besoin urgent,Besoin urgent,Besoin urgent,Besoin urgent,Besoin urgent,Besoin urgent,je connais bien,je connais bien,je connais bien,je connais bien,je connais bien,je connais un peu,je ne connais pas du tout,je connais un peu,je ne connais pas du tout,je connais un peu,je connais un peu,je connais un peu,je connais un peu,je ne connais pas du tout,je ne connais pas du tout,je connais un peu,je connais bien,je ne connais pas du tout,je ne connais pas du tout,je connais un peu,je connais un peu,je connais un peu,je connais un peu,je connais un peu,je connais un peu,je connais bien,je connais bien,je connais bien,je connais bien,je connais un peu,je connais un peu,je connais un peu,je ne connais pas du tout,je ne connais pas du tout,je ne connais pas du tout,je ne connais pas du tout,je ne connais pas du tout,je connais bien,je connais bien,je ne connais pas du tout,je ne connais pas du tout,je ne connais pas du tout,je ne connais pas du tout,je ne connais pas du tout,je connais bien,je connais un peu,je connais un peu,je connais bien,je ne connais pas du tout,je ne connais pas du tout,je connais bien,je ne connais pas du tout,je ne connais pas du tout,je ne connais pas du tout,je ne connais pas du tout,je ne connais pas du tout,je ne connais pas du tout,je ne connais pas du tout,je ne connais pas du tout,je connais un peu,je connais bien,je ne connais pas du tout,je ne connais pas du tout,je ne connais pas du tout,je connais bien,je connais bien,je connais bien,je connais bien,je ne connais pas du tout,je connais bien,je connais bien,je connais bien,je connais un peu,je connais un peu,je connais un peu,je ne connais pas du tout,je connais un peu,je connais un peu,je ne connais pas du tout,je ne connais pas du tout,je connais un peu,je connais un peu,je ne connais pas du tout,je ne connais pas du tout,je ne connais pas du tout,je ne connais pas du tout,je connais un peu,je connais un peu,je connais bien,je ne connais pas du tout,je ne connais pas du tout,je ne connais pas du tout,je connais bien,je connais un peu,je suis expert(e),,je suis expert(e),,,,,,,,,,,,,je connais bien,je ne connais pas du tout,je ne connais pas du tout,je ne connais pas du tout,je ne connais pas du tout,je ne connais pas du tout,je ne connais pas du tout,je ne connais pas du tout,je ne connais pas du tout,je connais un peu,je ne connais pas du tout,souvent,rarement,souvent,souvent,souvent,rarement,jamais,souvent,jamais,jamais,souvent,jamais,jamais,souvent,jamais,rarement,jamais,jamais,rarement,jamais,,,,,,,,,,
20/09/2021 11:19:07,Aissa,KERT,aissa.kert@gmail.com,18907133,,M2 THYP,https://drive.google.com/open?id=1D5lraPeC66VzLfdzX_U6bJINvj3d_LId,Oui,,De qualité moyenne,,,aissakert,,,,Ingénieur informatique,M 1 informatique,Besoin d'approfondissement,Besoin d'approfondissement,Besoin d'approfondissement,Besoin d'approfondissement,Besoin d'approfondissement,Besoin d'approfondissement,Besoin d'approfondissement,Besoin d'approfondissement,Besoin d'approfondissement,Besoin d'approfondissement,Besoin d'approfondissement,Besoin d'approfondissement,Besoin d'approfondissement,Besoin d'approfondissement,Besoin urgent,Besoin d'approfondissement,Besoin urgent,Besoin urgent,Besoin d'approfondissement,Besoin d'approfondissement,Besoin urgent,Besoin d'approfondissement,Besoin d'approfondissement,Besoin d'approfondissement,Besoin d'approfondissement,Besoin d'approfondissement,Besoin urgent,Besoin urgent,Besoin urgent,je connais un peu,je connais un peu,je ne connais pas du tout,je ne connais pas du tout,je connais un peu,je connais un peu,je ne connais pas du tout,je ne connais pas du tout,je ne connais pas du tout,je ne connais pas du tout,je ne connais pas du tout,je ne connais pas du tout,je ne connais pas du tout,je ne connais pas du tout,je ne connais pas du tout,je ne connais pas du tout,je ne connais pas du tout,je ne connais pas du tout,je ne connais pas du tout,je ne connais pas du tout,je ne connais pas du tout,je ne connais pas du tout,je connais un peu,je ne connais pas du tout,je ne connais pas du tout,je connais un peu,je ne connais pas du tout,je ne connais pas du tout,je ne connais pas du tout,je connais un peu,je connais un peu,je ne connais pas du tout,je ne connais pas du tout,je connais un peu,je ne connais pas du tout,je ne connais pas du tout,je connais un peu,je connais un peu,je ne connais pas du tout,je ne connais pas du tout,je ne connais pas du tout,je ne connais pas du tout,je ne connais pas du tout,je connais bien,je connais bien,je ne connais pas du tout,je ne connais pas du tout,je connais bien,je ne connais pas du tout,je ne connais pas du tout,je ne connais pas du tout,je ne connais pas du tout,je ne connais pas du tout,je connais bien,je ne connais pas du tout,je ne connais pas du tout,je ne connais pas du tout,je ne connais pas du tout,je ne connais pas du tout,je connais bien,je ne connais pas du tout,je ne connais pas du tout,je ne connais pas du tout,je ne connais pas du tout,je connais un peu,je connais un peu,je ne connais pas du tout,je connais un peu,je ne connais pas du tout,je connais un peu,je connais un peu,je connais un peu,je connais un peu,je connais un peu,je connais un peu,je connais un peu,je ne connais pas du tout,je connais un peu,je ne connais pas du tout,je ne connais pas du tout,je connais un peu,je connais un peu,je ne connais pas du tout,je ne connais pas du tout,je ne connais pas du tout,je ne connais pas du tout,je ne connais pas du tout,je ne connais pas du tout,je ne connais pas du tout,je ne connais pas du tout,je ne connais pas du tout,je ne connais pas du tout,je connais bien,je connais un peu,je suis expert(e),je ne connais pas du tout,je connais un peu,je ne connais pas du tout,je ne connais pas du tout,je ne connais pas du tout,je ne connais pas du tout,je ne connais pas du tout,je ne connais pas du tout,je ne connais pas du tout,je ne connais pas du tout,je ne connais pas du tout,je ne connais pas du tout,je ne connais pas du tout,je ne connais pas du tout,je connais un peu,je ne connais pas du tout,je connais un peu,je ne connais pas du tout,je ne connais pas du tout,je ne connais pas du tout,je ne connais pas du tout,je ne connais pas du tout,je ne connais pas du tout,je ne connais pas du tout,je ne connais pas du tout,souvent,rarement,souvent,souvent,souvent,jamais,rarement,rarement,rarement,jamais,je suis accro,jamais,jamais,souvent,jamais,jamais,jamais,jamais,jamais,jamais,De bonne qualité,je ne connais pas du tout,,je ne connais pas du tout,je ne connais pas du tout,je ne connais pas du tout,je ne connais pas du tout,je ne connais pas du tout,je ne connais pas du tout,je ne connais pas du tout
20/09/2021 11:21:09,Raouf,ZERTAL,z.raouf97@gmail.com,0,,M2 THYP,https://drive.google.com/open?id=17vm709G8gx9PgSCSjddwOG8KjLyRqRpR,Oui,Pas utilisé,De bonne qualité,Pas utilisé,Pas utilisé,ZertalRaouf,raoufzertal,raoufzertal,"Graphiste, Développeur, Chef de projet, Ingénieur informatique","Développeur, Chef de projet, Lead dev",4ème année ,Besoin d'approfondissement,Besoin d'approfondissement,Besoin d'approfondissement,Besoin d'approfondissement,Besoin d'approfondissement,Besoin d'approfondissement,Besoin d'approfondissement,Besoin d'approfondissement,Besoin d'approfondissement,Besoin d'approfondissement,Besoin d'approfondissement,Besoin d'approfondissement,Besoin d'approfondissement,Besoin d'approfondissement,Besoin d'approfondissement,Besoin d'approfondissement,Besoin d'approfondissement,Besoin d'approfondissement,Besoin d'approfondissement,Besoin d'approfondissement,Besoin d'approfondissement,Besoin d'approfondissement,Besoin d'approfondissement,Besoin d'approfondissement,,Besoin d'approfondissement,Besoin d'approfondissement,Besoin d'approfondissement,Besoin d'approfondissement,je connais bien,je suis expert(e),je suis expert(e),je connais bien,je connais un peu,je connais un peu,je connais un peu,je connais un peu,je connais un peu,je connais un peu,je connais un peu,je connais un peu,je connais un peu,je connais un peu,je connais un peu,je connais un peu,je connais un peu,je connais un peu,je connais un peu,je connais un peu,je connais un peu,je connais un peu,je connais un peu,je connais un peu,je connais un peu,je connais un peu,je connais un peu,je connais un peu,je connais un peu,je connais un peu,je connais un peu,je ne connais pas du tout,je ne connais pas du tout,je ne connais pas du tout,je ne connais pas du tout,je connais un peu,je connais un peu,je connais un peu,je connais bien,je connais un peu,je connais un peu,je connais un peu,je ne connais pas du tout,je connais un peu,je connais bien,je connais bien,je connais bien,je connais bien,je connais bien,je ne connais pas du tout,je connais bien,je ne connais pas du tout,je ne connais pas du tout,je connais un peu,je ne connais pas du tout,je connais bien,je connais un peu,je ne connais pas du tout,je ne connais pas du tout,je connais un peu,je connais bien,je connais un peu,je connais bien,je connais un peu,je suis expert(e),je suis expert(e),je connais un peu,je connais un peu,je ne connais pas du tout,je connais bien,je suis expert(e),je suis expert(e),je connais un peu,je ne connais pas du tout,je ne connais pas du tout,je connais un peu,je connais un peu,je connais bien,je ne connais pas du tout,je ne connais pas du tout,je connais bien,je ne connais pas du tout,je ne connais pas du tout,je connais bien,je connais un peu,je ne connais pas du tout,je connais un peu,je connais un peu,je connais bien,je ne connais pas du tout,je ne connais pas du tout,je connais un peu,je suis expert(e),je connais bien,je suis expert(e),je ne connais pas du tout,je ne connais pas du tout,je ne connais pas du tout,je ne connais pas du tout,je ne connais pas du tout,je ne connais pas du tout,je ne connais pas du tout,je ne connais pas du tout,je ne connais pas du tout,je ne connais pas du tout,je ne connais pas du tout,je ne connais pas du tout,je ne connais pas du tout,je ne connais pas du tout,je connais bien,je ne connais pas du tout,je connais un peu,je ne connais pas du tout,je ne connais pas du tout,je ne connais pas du tout,je connais un peu,je ne connais pas du tout,je ne connais pas du tout,je connais un peu,je connais un peu,je suis accro,rarement,je suis accro,je suis accro,je suis accro,rarement,jamais,je suis accro,je suis accro,rarement,je suis accro,jamais,jamais,rarement,jamais,jamais,jamais,jamais,rarement,jamais,De bonne qualité,je ne connais pas du tout,,je ne connais pas du tout,je ne connais pas du tout,je ne connais pas du tout,je ne connais pas du tout,je ne connais pas du tout,je ne connais pas du tout,je ne connais pas du tout
